Greece,Eurotankers Incorporated ,Valeri,8724860,Liberia,"Gadani, Pakistan",Eurotankers Incorporated ,Angelina Navigation Incorporated ,1988,unknown,9680,Product Tanker,N,
Greece,Eurotankers Incorporated ,Veres,8729951,Liberia,"Gadani, Pakistan",Eurotankers Incorporated ,Dynastic Maritime Incorporated ,1989,unknown,9680,Product Tanker,N,
Greece,Gregory P. Callimanopulos Group of Companies,United Resolve,9018476,Liberia,"Gadani, Pakistan",Marine Management Services M.C. ,Trade Ventures Incorporated ,1992,440,19960,Crude Oil Tanker,N,
Greece,Gregory P. Callimanopulos Group of Companies,United Star,9014846,Liberia,"Gadani, Pakistan",Marine Management Services M.C. ,United Star Incorporated ,1992,438,20766,Crude Oil Tanker,N,
Greece,Marmaras Navigation Limited,Aristeas P.,8315918,Liberia,"Gadani, Pakistan",Marmaras Navigation Limited,Arist Maritime Incorporated ,1985,482,7919,Bulker,Y,
Greece,Polembros Shipping Limited,Vigour,8513649,Liberia,"Gadani, Pakistan",Polembros Shipping Limited,Crystal Holdings Limited ,1995,512,21687,Crude Oil Tanker,N,
Greece,Top Ships Incorporated,Brillante Virtuoso,9014822,Liberia,"Gadani, Pakistan",Top Tanker Management Incorporated ,Suez Fortune Investments Limited ,1992,unknown,20502,Crude Oil Tanker,N,
Greece,Aegean Marine Petroleum S.A. ,Edeva,8920347,Malta,"Gadani, Pakistan",Aegean Shipping Management S.A. ,Aegean Nav. S.A. ,1992,unknown,10830,Tanker,N,
Greece,Bright Navigation Incorporated,Popi S.,8028644,Malta,"Gadani, Pakistan",Bright Navigation Incorporated,Rising Brothers Shipping Limited ,1982,480,11564,Bulker,Y,
Greece,Chian Spirit Maritime Enterprises Incorporated,Panamax Anna,8202678,Malta,"Gadani, Pakistan",Chian Spirit Maritime Enterprises Incorporated,Thalassa Marine Incorporated ,1982,432,12272,Bulker,Y,
Greece,Hellenic Star Shipping Company S.A.,Sea Pride,8011794,Malta,"Gadani, Pakistan",Hellenic Star Shipping Company S.A.,Malcon Nav. Company Limited ,1983,unknown,11902,Bulker,N,
Greece,Queensway Navigation Company Limited,Vemabaltic,8325066,Malta,"Gadani, Pakistan",Queensway Navigation Company Limited,Sea Baltic Maritime Limited ,1986,435,17707,Product Tanker,N,
Greece,Alison Management Corporation,Sea Wave,9000546,Marshall Islands,"Gadani, Pakistan",Alison Management Corporation,Choral Services Limited ,1991,475,20179,Crude Oil Tanker,N,
Greece,Prime Marine Management Incorporated,Blackfin,8913837,Marshall Islands,"Gadani, Pakistan",Prime Marine Management Incorporated,Blackfin Shipping Incorporated ,1990,440,14830,Chemical and Oil tanker,N,
Greece,Prime Marine Management Incorporated,Bluefin,8715510,Marshall Islands,"Gadani, Pakistan",Prime Marine Management Incorporated,Bluefin Shipping Incorporated ,1989,507,14830,Chemical and Oil tanker,N,
Greece,Prime Marine Management Incorporated,Bonito,8615552,Marshall Islands,"Gadani, Pakistan",Prime Marine Management Incorporated,Bonito Shipping Incorporated ,1988,403,14898,Chemical and Oil tanker,N,
Greece,Prime Marine Management Incorporated ,Cougar,8618906,Marshall Islands,"Gadani, Pakistan",Prime Marine Management Incorporated ,Cougar Shipping Incorporated ,1989,unknown,9550,Product Tanker,N,
Greece,Prime Marine Management Incorporated,Lion,8618918,Marshall Islands,"Gadani, Pakistan",Prime Marine Management Incorporated,Lion Shipping Incorporated ,1989,410,9550,Product Tanker,N,
Greece,Prime Marine Management Incorporated ,Longfin,8700008,Marshall Islands,"Gadani, Pakistan",Prime Marine Management Incorporated ,Longfin Shipping Incorporated ,1988,443,15050,Chemical and Oil tanker,N,
Greece,Prime Marine Management Incorporated ,Smooth Hound,8715522,Marshall Islands,"Gadani, Pakistan",Prime Marine Management Incorporated ,Smooth Hound Shipping Incorporated ,1989,505,14830,Chemical and oil tanker,N,
Greece,Blue Fleet Management Company Limited,Royal Diamond,8300391,Panama,"Gadani, Pakistan",Blue Fleet Management Company Limited,Societe de Navgation S.A. ,1984,465,5843,Bulker,N,
Greece,Commercial S.A. ,Markella,9012771,Panama,"Gadani, Pakistan",Commercial S.A. ,Navinord S.A. ,1993,unknown,unknown,Containership,Y,
Greece,IMS S.A.,Lanka,8309787,Panama,"Gadani, Pakistan",IMS S.A.,Rofos Navigation Limited ,1985,unknown,13707,Chemical and Oil tanker,N,
Greece,Trustoil Tankers S.A. ,Trust Navigator,8814421,Panama,"Gadani, Pakistan",Trustoil Tankers S.A. ,Misty Shipmanagement S.A. ,1991,unknown,8450,Product Tanker,N,
Greece,World Carrier Corporation S.A.,Ailsa Craig,7349950,Panama,"Gadani, Pakistan",World Carrier Corporation S.A.,Ailsa Shipping Corporation ,1974,430,32000,Floating Production tanker ,Y,
Greece,Polembros Shipping Limited,Diamond Warrior,8308850,St Vincent & Grenadines,"Gadani, Pakistan",Polembros Shipping Limited,International Alliance Limited ,1984,482,25516,Bulk Ore Carrier,Y,
Greece,Hellenic Star Shipping Company S.A.,Sea Bird,8117328,Tonga,"Gadani, Pakistan",Hellenic Star Shipping Company S.A.,Sea Bird Shipping Limited ,1984,510,11600,Bulker,Y,
Greece,Aegean Marine Petroleum S.A. ,White Rose,8033314,Tuvalu,"Gadani, Pakistan",Aegean Bunkering Services Incorporated ,Aegean Tanking S.A. ,1981,unknown,16240,Product Tanker,N,
Hong Kong,Sinokor Company Limited,Carrier,8204028,Comoros,"Gadani, Pakistan",Chokang Shipping Company Limited ,Central Carrier Shipping SA ,1983,425,14500,Bulker,N,
Hong Kong,Winning Shipping (HK) Company Limited,Winning Brother,8406078,Panama,"Gadani, Pakistan",Winning Shipping (HK) Company Limited,Graceful Shipping S.A. ,1985,420,22687,Bulker,Y,
Hong Kong,Titan Petrochemicals Group Limited,Titan,8618205,Tuvalu,"Gadani, Pakistan",Titan Ocean Private Limited ,Perlama Corporation ,1988,465,34115,Crude Oil Tanker,Y,
India,The Shipping Corporation of India Limited ,Murshid,8409769,Comoros,"Gadani, Pakistan",The Shipping Corporation of India Limited ,The Shipping Corporation of India Limited ,1987,unknown,unknown,Bulker ,Y,
India,The Shipping Corporation of India Limited ,Prayag,8321072,Comoros,"Gadani, Pakistan",The Shipping Corporation of India Limited ,The Shipping Corporation of India Limited ,1986,unknown,unknown,Bulker ,Y,
India,Essar Shipping & Logistics Limited,Govind Prasad,7926112,India,"Gadani, Pakistan",Essar Shipping & Logistics Limited,Essar Shipping & Logistics Limited,1981,unknown,unknown,Bulker,Y,
India,Essar Shipping & Logistics Limited,Mahavir Prasad,8023993,India,"Gadani, Pakistan",Essar Shipping Ports and Logistics Limited (ESPLL) ,Essar Shipping Ports and Logistics Limited (ESPLL) ,1983,398,18882,Bulker,Y,
India,K.K. Birla Group of Companies,Ratna Urvi,8813568,India,"Gadani, Pakistan",Chambal Fertilisers & Chemicals Limited ,Chambal Fertilisers & Chemicals Limited ,1989,410,14250,Crude Oil Tanker,Y,
India,Mercator Limited ,Prem Divya,9138599,India,"Gadani, Pakistan",Mercator Limited ,Mercator Limited ,1998,unknown,unknown,Crude Oil Tanker,N,
India,The Shipping Corporation of India Limited,Maha,7422738,India,"Gadani, Pakistan",The Shipping Corporation of India Limited,The Shipping Corporation of India Limited,1978,422,20168,Bulk and oil carrier,N,
India,Five Stars Shipping Company Private Limited,Maha Deepa,8128676,Panama,"Gadani, Pakistan",Five Stars Shipping Company Private Limited,Ganesh Shipping Incorporated ,1985,405,8809,Bulker,N,
India,Hermes Maritime Services Private Limited,Maheshwari,8026153,Panama,"Gadani, Pakistan",Hermes Maritime Services Private Limited,Maheshwari Shipping Company Incorporated ,1986,unknown,unknown,Bulker,Y,
India,Hermes Maritime Services Private Limited,Partnership,7920039,Panama,"Gadani, Pakistan",Hermes Maritime Services Private Limited,Ocean Castle Shipping Incorporated ,1981,unknown,unknown,Bulker,Y,
India,Mercator Limited ,Vasco Bharathi,9012783,Singapore,"Gadani, Pakistan",Mercator Limited ,Vasco Maritime Private Limited ,1993,unknown,unknown,Containership ,Y,
India,The Shipping Corporation of India Limited ,Shine,8409771,Tuvalu,"Gadani, Pakistan",The Shipping Corporation of India Limited ,The Shipping Corporation of India Limited ,1987,430,10100,Bulker ,Y,
Indonesia,P.T. Berlian Laju Tanker Tbk. ,Tridonawati,9000534,Liberia,"Gadani, Pakistan",P.T. Berlian Laju Tanker Tbk. ,Tridonawati Maritime Corporation ,1991,508,20187,Crude Oil Tanker,N,
Indonesia,P.T. Berlian Laju Tanker Tbk. ,Trirasa,9000510,Singapore,"Gadani, Pakistan",P.T. Berlian Laju Tanker Tbk. ,Anggraini Maritime Private Limited ,1991,508,20187,Crude Oil Tanker,N,
Jordan,Government of the Hashemite Kingdom of Jordan ,Jerash,7382263,Jordan,"Gadani, Pakistan",Ministry of Mineral Resources of The Kingdom Jordan ,Ministry of Mineral Resources of The Kingdom Jordan ,1976,unknown,unknown,Crude Oil Tanker,Y,
Lebanon,Mody Shipping Company S.a.r.l.,Little Princess,7712042,Lebanon,"Gadani, Pakistan",Mody Shipping Company S.a.r.l.,Karim Shipping Company Limited Incorporated ,1979,unknown,unknown,General cargo ship,N,
Malaysia,Atlantic Wave Management Sendirian Berhad,Ocean Blaze,8109022,Sierra Leone,"Gadani, Pakistan",Atlantic Wave Management Sendirian Berhad,Bridge Nav. Limited ,1984,450,8120,Bulker,Y,
Marshall Islands,Benita Shipping S.A.,Marley,8009002,North Korea,"Gadani, Pakistan",Benita Shipping S.A.,Benita Shipping S.A.,1984,unknown,unknown,Product tanker,N,
Mexico,Government of Mexico ,Meizhen,7383346,Sierra Leone,"Gadani, Pakistan",Petroleos Mexicanos Gerencia de Transportacion Maritima (Pemex) ,Petroleos Mexicanos Gerencia de Transportacion Maritima (Pemex) ,1977,unknown,unknown,Product tanker,Y,
Monaco,Sammy Ofer Group Monaco,Adriatic Sea,9002269,Liberia,"Gadani, Pakistan",Tanker Pacific Management (Singapore) Private Limited ,Bezon Shipping Limited ,1992,500,19792,Crude Oil Tanker,N,
Monaco,Sammy Ofer Group Monaco,Alaskan Sea,9002257,Liberia,"Gadani, Pakistan",Tanker Pacific Management (Singapore) Private Limited ,Michson Shipping Limited ,1992,500,19790,Crude Oil Tanker,N,
Monaco,Sammy Ofer Group Monaco ,Brilliant Jewel,8718392,Liberia,"Gadani, Pakistan",Tanker Pacific Management (Singapore) Private Limited ,Azara Maritime Incorporated ,1989,505,31000,Crude Oil Tanker,Y,
Monaco,Sammy Ofer Group Monaco ,Wugang Star,8902644,Liberia,"Gadani, Pakistan",Zodiac Maritime Agencies Limited ,Rokish Shipping Limited ,1991,395,25652,Bulk ore Carrier,N,
Monaco,Sammy Ofer Group Monaco ,Ionian Sea,8920244,Singapore,"Gadani, Pakistan",Tanker Pacific Management (Singapore) Private Limited ,Keenson Shipping Incorporated ,1992,495,16787,Crude Oil Tanker,N,
Netherlands,Royal Boskalis Westminster N.V. ,Trus-1,8322038,Comoros,"Gadani, Pakistan",Royal Boskalis Westminster N.V. ,BW Marine (Cyprus) Limited ,1986,unknown,unknown,Crude Oil Tanker,N,
Norway,Prosafe AS,FSO Favor,7109013,Liberia,"Gadani, Pakistan",Prosafe Production Services Private Limited ,Prosafe Production Services Private Limited ,1971,468,14631,Floating Storage tanker,Y,
Norway,Knutsen OAS Shipping AS ,Anna Knutsen,8504090,Norway,"Gadani, Pakistan",Knutsen OAS Shipping AS ,Knutsen Boyelaster VIII KS ,1987,unknown,23521,Crude Oil Tanker,N,
Norway,Farstad Shipping ASA,Lady Glassy,7104611,Singapore,"Gadani, Pakistan",Farstad Shipping ASA,Farstad Shipping ASA,1971,unknown,unknown,Product tanker,Y,
Norway,Bulk Transloading AS,Rans,8020185,Unknown,"Gadani, Pakistan",Bulk Transloading AS,Bulk Transloading AS,1982,446,17850,Bulker,Y,
Pakistan,Capeshore Resources & Trading,CS Alpha,8404836,Comoros,"Gadani, Pakistan",Palaemon Marine Serv Pvt Ltd,Palaemon Marine Serv Pvt Ltd,1985,unknown,unknown,Bulker,Y,
Pakistan,Government of Pakistan ,Sargodha,7822017,Pakistan,"Gadani, Pakistan",Pakistan National Shipping Corporation (PNSC),Sargodha Shipping (Private) Limited ,1980,465,5537,General cargo ship,N,
Pakistan,Tomini Ship Management Private Limited,Faith,9047427,Panama,"Gadani, Pakistan",Tomini Ship Management Private Limited,Fairline Maritime Panama Corporation ,1994,427,18238,Crude Oil Tanker,N,
Pakistan,Tomini Ship Management Private Limited ,Nita,8520331,Togo,"Gadani, Pakistan",Tomini Ship Management Private Limited ,Empire Marine Group Services Limited ,1988,498,,Crude Oil Tanker,N,
Romania,Interocean Services S.r.l.,Sancris,7524287,Panama,"Gadani, Pakistan",Interocean Services S.r.l.,Naval Heritage Maritime S.A. ,1975,415,7518,General Cargo ship,N,
Russia,Palesano Company Incorporated ,Ostsee Merchant,8407694,Marshall Islands,"Gadani, Pakistan",Palesano Company Incorporated ,Palesano Company Incorporated ,1985,410,12520,Bulker,N,
Saudi Arabia,Bakri Navigation Company Limited ,Al Kawthar,8203804,Saudi Arabia,"Gadani, Pakistan",Red Sea Marine Services Company Limited ,Good Hope Petroleum Investment Incorporated ,1982,unknown,unknown,Product tanker,N,
Saudi Arabia,Bakri Navigation Company Limited,Al Muminah,8311493,Saudi Arabia,"Gadani, Pakistan",Red Sea Marine Services Company Limited ,Al Andalus International Navigation Company Limited ,1985,440,15286,Product tanker,N,
Singapore,Universal Nav. Private Limited,Glory 2,7825576,Comoros,"Gadani, Pakistan",Universal Nav. Private Limited,Universal Shipping Singapore Limited ,1980,unknown,unknown,Bulker,Y,
Syria,Hatoun Shipping Company,Khaled T,7913141,St Vincent & Grenadines,"Gadani, Pakistan",Hatoun Shipping Company,Crystal Shipping Limited ,1980,unknown,unknown,Bulker ,Y,
Syria,Omar-MBZ Shipping Company S.A.,Nadin II,7500267,Tanzania,"Gadani, Pakistan",Omar-MBZ Shipping Company S.A.,Omar-MBZ Shipping Company S.A.,1976,unknown,unknown,General cargo ship,Y,
Taiwan,Taiwan Maritime Transportation Company Limited (TMT Company Limited),L Elephant,9033335,Liberia,"Gadani, Pakistan",Taiwan Maritime Transportation Company Limited (TMT Company Limited),L Elephant Corporation ,1992,415,32885,Crude oil tanker,N,
Taiwan,CPC Corporation Taiwan,Tsu,9006198,St Kitts-Nevis,"Gadani, Pakistan",CPC Corporation Taiwan,CPC Corporation Taiwan,1992,unknown,24766,Crude oil tanker,Y,
Taiwan,CPC Corporation Taiwan,Yu,8617122,Tuvalu,"Gadani, Pakistan",CPC Corporation Taiwan,CPC Corporation Taiwan,1988,unknown,18497,Crude oil tanker,Y,
Thailand,Nathalin Offshore Company Limited,Mera,8701844,Comoros,"Gadani, Pakistan",Nathalin Offshore Company Limited,Nathalin Offshore Company Limited,1987,435,32724,Crude oil tanker,Y,
Turkey,Kanlar Denizcilik Insaat Nakliyat Gemi Insaa Ticaret ve Sanayi Limited Sirketi ,Anna K,7525487,Moldova,"Gadani, Pakistan",Kanlar Denizcilik Insaat Nakliyat Gemi Insaa Ticaret ve Sanayi Limited Sirketi ,Nirvana Shipholding Limited ,1977,unknown,unknown,General cargo ship,Y,
Turkey,SeaHorse Denizcilik ve Muhendislik Ticaret Limited Sirketi ,Lady Sera,8026660,Panama,"Gadani, Pakistan",SeaHorse Denizcilik ve Muhendislik Ticaret Limited Sirketi ,Sera Shipping Limited Corporation ,1982,378,6406,Bulker,Y,
Turkey,Bergen Shipping Limited,Servet Y,8119340,Turkey,"Gadani, Pakistan",Bergen Shipping Limited,Yakamoz Denizcilik ic ve Denizcilik ve Ticaret Sirketi ,1983,480,8344,Bulker,Y,
UAE,Musandam Shipping LLC,Zahra I,8405024,Sierra Leone,"Gadani, Pakistan",Musandam Shipping LLC,Al Battat ,1985,unknown,unknown,RoRo,N,
UAE,Penta Ocean Ship Management and Operation LLC,Volga,9003237,Togo,"Gadani, Pakistan",Penta Ocean Ship Management and Operation LLC,Tabuk Maritime Incorporated ,1992,405,unknown,Crude Oil Tanker,N,
UK,DHT Holdings Incorporated ,Ania,9053672,Comoros,"Gadani, Pakistan",DHT Maritime Incorporated ,Ania Aframax Corporation ,1994,425,17045,Crude Oil Tanker,N,
UK,INTRESCO Limited ,St. Vasilios,7916337,Liberia,"Gadani, Pakistan",INTRESCO Limited ,Vasilios Navigation Company Incorporated ,1981,485,11604,Bulker,Y,
UK,Norse Management (UK) Limited ,Maud ,9036519,Liberia,"Gadani, Pakistan",Norse Management (UK) Limited ,Maud Shipping Limited ,1993,unknown,16811,Bulk and Oil Carrier,N,
UK,Seven Seas Maritime Limited ,Alexia,8100894,Malta,"Gadani, Pakistan",Seven Seas Maritime Limited ,Zeus Nav. Company Limited ,1984,unknown,7717,Bulker,Y,
UK,Seven Seas Maritime Limited ,Ariana,8014150,Malta,"Gadani, Pakistan",Seven Seas Maritime Limited ,Candela Shipping Company Limited ,1984,unknown,12327,Bulker,Y,
UK,Holbud Ship Management Limited,Al Khaliq,8307155,Panama,"Gadani, Pakistan",Holbud Ship Management Limited,Rosebud Investment Corporation ,1984,460,6624,Bulker,Y,
UK,Holbud Ship Management Limited ,Majestic,8307399,Panama,"Gadani, Pakistan",Holbud Ship Management Limited ,Sanibel Maritime Incorporated ,1985,unknown,7778,Bulker,Y,
Ukraine,Tech Project Limited,Phoenix,8911217,Dominica,"Gadani, Pakistan",Tech Project Limited,Serena Sea Navigation Company ,1990,420,unknown,Bulker,N,
USA,General Maritime Corporation,GenMar Alexandra,9007568,Marshall Islands,"Gadani, Pakistan",General Maritime Management (Portugal) LLC ,GMR Alexandra LLC ,1992,500,15145,Crude oil tanker,N,
USA,TBS International Plc ,Nyack Princess,8308953,Philippines,"Gadani, Pakistan",TBS Shipping Services Incorporated ,Darby Navigation Corporation ,1984,401,7143,Bulker,Y,
USA,Attransco Incorporated,Delaware Trader,8008929,USA,"Gadani, Pakistan",Attransco Incorporated,Attransco Incorporated,1982,430,11105,Product Tanker ,N,
Vietnam,Government of the Socialist Republic of Vietnam ,Asean Sea 01,8005537,Panama,"Gadani, Pakistan",Vinashin Petroleum Investment & Transport Joint Stock Company (Shinpetrol) ,Vinashin Petroleum Investment & Transport Joint Stock Company (Shinpetrol) ,1981,465,6370,Bulker,Y,
Vietnam,Government of the Socialist Republic of Vietnam,VSP Diamond,8300901,Panama,"Gadani, Pakistan",Vinashin Petroleum Investment & Transport Joint Stock Company (Shinpetrol) ,Vinashin Petroleum Investment & Transport Joint Stock Company (Shinpetrol) ,1984,383,unknown,Bulker,Y,
China,Oriental Ocean Shipping Holding Private Limited ,Welwater,8800391,Panama,"Gaogang, China ",Oriental Ocean Shipping Holding Private Limited ,Orient Hong Kong Investment Limited ,1992,355,24308,Bulker,N,
Hong Kong,Huatai International Shipping Limited,Lucky Rainbow,8106769,Panama,"Gaogang, China ",Huatai International Shipping Limited,Huatai International Shipping Limited,1985,unknown,13768,Bulk and oil carrier,N,
Hong Kong,Shunxing Shipping Hong Kong ,Shun Xing,8422955,Panama,"Gaogang, China ",Shunxing Shipping Hong Kong ,Shunxing Shipping Hong Kong ,1985,420,15820,Bulker,N,
Hong Kong,Well Step Transportation Limited ,Xin Hong,8021505,Panama,"Gaogang, China ",Well Step Transportation Limited ,Well Step Transportation Limited ,1982,unknown,7965,General cargo ship,N,
Latvia,Unimars Limited (Universal Marine Service) ,Taigeta,7904516,Dominica,"Ghent, Belgium",Unimars Limited (Universal Marine Service) ,Vesti Shipping Company Limited ,1980,unknown,1230,General cargo ship,Y,
UK,Torbulk Limited ,Swan Diana,8843848,Cook Islands,"Ghent, Belgium",Torbulk Limited ,Swanland Shipping Limited ,1982,unknown,unknown,General cargo ship,Y,
UK,Serco Denholm Limited ,SD Newton,7342940,UK,"Ghent, Belgium",Serco Denholm Limited ,Serco Denholm Marine Services Limited ,1986,unknown,unknown,Cable Ship,Y,
Croatia,Kurs D.O.O ,Rosethorn,8028307,St Vincent & Grenadines,"Grenaa, Denmark",Kurs D.O.O ,Brodo Trading Limited ,1982,unknown,unknown,General cargo ship,Y,
Denmark,Bjerrum & Jensen ApS ,Monsunen,6522593,Denmark,"Grenaa, Denmark",Bjerrum & Jensen ApS ,Rederiet Hersom APS ,1965,unknown,unknown,General cargo ship,Y,
Denmark,Rederiet Lindholm ApS,Anders Rousing,7826374,Denmark,"Grenaa, Denmark",Rederiet Lindholm ApS,Rederiet Lindholm ApS,1979,unknown,unknown,General cargo ship,Y,
Denmark,Stella Shipping A/S ,Vangsnes,8513326,St Kitts-Nevis,"Grenaa, Denmark",Stella Shipping A/S ,Vangsnes K/S ,1985,unknown,unknown,General cargo ship,N,
Germany,Hans-Uwe Meyer Bereederungs GmbH & Company KG ,Cranz,7702126,Antigua & Barbuda,"Grenaa, Denmark",Hans-Uwe Meyer Bereederungs GmbH & Company KG ,ms Cranz GmbH & Company KG ,1977,unknown,1182,General cargo ship,N,
Germany,Werse Bereederungs GmbH & Company KG ,Topas,8607672,Antigua & Barbuda,"Grenaa, Denmark",Werse Bereederungs GmbH & Company KG ,Adria Schiffahrts GmbH & Company KG ,1988,unknown,unknown,General cargo ship,Y,
Netherlands,Vroon B.V. ,VOS Challenger,7392983,UK,"Grenaa, Denmark",Vroon Offshore Services B.V. ,Vroon Offshore Services Limited ,1975,unknown,unknown,Tug/Supply vessel,Y,
Norway,Tevla A.S ,Tevla,6903486,Cook Islands,"Grenaa, Denmark",Tevla A.S ,Tevla A.S ,1968,unknown,unknown,General cargo ship,Y,
Norway,Odd Wagle ,Liv,7633466,Norway,"Grenaa, Denmark",Odd Wagle ,Liv AS ,1977,unknown,unknown,General cargo ship,Y,
Norway,Seatrans Group ,Baltic Guide,8017073,Norway,"Grenaa, Denmark",Seatrans DA ,Euro Trans Skips AS ,1982,unknown,unknown,General cargo ship,Y,
Norway,Seatrans Group ,Trans Holm,7931193,Norway,"Grenaa, Denmark",Seatrans DA ,Euro Trans Skips AS ,1981,unknown,unknown,Chemical Tanker,N,
Sweden,KA Rederi AB ,Debora,6501537,Norway,"Grenaa, Denmark",KA Rederi AB ,KA Rederi AB ,1965,unknown,unknown,General cargo ship,N,
Sweden,Edvin Svensons Skeppsmakleri AB,Ala,6812637,Panama,"Grenaa, Denmark",Edvin Svensons Skeppsmakleri AB,Timberlake Corporation ,1968,unknown,unknown,General cargo ship,Y,
Sweden,Chemveg AB ,Margita,7036591,Sweden,"Grenaa, Denmark",Chemveg AB ,Chemveg AB ,1971,unknown,unknown,Chemical Tanker,N,
USA,McDermott Incorporated ,Hebron Sea,7403471,Canada,"Grenaa, Denmark",J. Ray McDermott Canada Limited,J. Ray McDermott Canada Limited,1975,unknown,unknown,Anchor Handling Tug,Y,
USA,SEACOR Holdings Incorporated ,Putford Sky,6607393,UK,"Grenaa, Denmark",SEACOR Marine (International) Limited & Southern North Sea (SEACOR SNS) ,Boston Putford Offshore Safety Limited ,1967,unknown,unknown,Offshore safety vessel,Y,
China,CPM Corporation Limited ,Sino East,8513819,Panama,"Guangzhou, China",Vasteast International Private Limited ,Pheachian Shipping Company Limited ,1987,unknown,unknown,Containership,N,
Belgium,Trireme Vessel Management N.V. ,Arctic Ocean,8613009,Bahamas,"Guayaquil, Ecuador",Trireme Vessel Management N.V. ,Arctic Ocean Shipping Limited ,1989,unknown,unknown,Reefer,Y,
Belgium,Trireme Vessel Management N.V. ,Atlantic Ocean,8612990,Bahamas,"Guayaquil, Ecuador",Trireme Vessel Management N.V. ,Atlantic Ocean Shipping Limited ,1989,unknown,unknown,Reefer,Y,
Monaco,V Ships Group Limited,Apollo 16,8405983,Liberia,India,International Tanker Management Limited ,Marianna Shipping Limited ,1985,470,34000,Crude Oil Tanker,Y,
Indonesia,P.T. Pelayaran Tempuran Emas Tbk. ,Supitan Mas,8310853,Indonesia,"Jakarta, Indonesia",P.T. Pelayaran Tempuran Emas Tbk. ,P.T. Pelayaran Tempuran Emas Tbk. ,1984,unknown,unknown,General Cargo Ship,N,
China,Nanjing Hua Hai Shipping Company Limited ,Hua Jin Hong,8103690,Panama,"Jiangmen, China",Nanjing Hua Hai Shipping Company Limited ,HK Huajinhong Shipping Company Limited ,1982,310,10866,Bulker,N,
Japan,Mitsui O.S.K. Lines Limited (MOL) ,Forest Wave,8915251,Panama,"Jiangmen, China",Mitsui O.S.K. Lines Limited (MOL) ,Sunny Ace Shipping S.A. ,1991,unknown,9089,Wood chip carrier,Y,
Bermuda,Gearbulk Holding Limited ,Kestrel Arrow,8013857,Bahamas,"Jiangyin, China",Gearbulk Holding Limited ,Gearbulk Shipowning Limited ,1983,unknown,unknown,General cargo ship,N,
Chile,Naviera Ultragas Limitada (Ultragas Group) ,Tupungato,8312758,Chile,"Jiangyin, China",Ultrabulk S.A. ,Tupungato Shipping Incorporated ,1984,unknown,unknown,Bulker,Y,
China,China Ocean Shipping (Group) Company (COSCO) ,Man Hai,8220228,China,"Jiangyin, China",COSCO Bulk Carrier Company Limited ,COSCO Bulk Carrier Company Limited ,1984,unknown,8670,Bulker,Y,
China,Yingkou Gang Run Logistics Company Limited ,Gang Run 7,7419535,China,"Jiangyin, China",Yingkou Gang Run Logistics Company Limited ,Yingkou Gang Run Logistics Company Limited ,1977,unknown,unknown,General cargo ship,Y,
China,China Ocean Shipping (Group) Company (COSCO) ,Sea Brilliance,8307167,Panama,"Jiangyin, China",COSCO Bulk Carrier Company Limited ,Jingyinghai Shipping Incorporated ,1984,unknown,6620,Bulk ore carrier,Y,
China,China Ocean Shipping (Group) Company (COSCO) ,Sea Rainbow,8307179,Panama,"Jiangyin, China",COSCO Bulk Carrier Company Limited ,Caihonghai Shipping Incorporated ,1984,unknown,6604,Bulker,Y,
China,China Shipping (Group) Company ,Lian Fu Star,8021804,Panama,"Jiangyin, China",Jiuzhou Shipping Company Limited ,Uni-Bright Shipping International Shipping Limited ,1982,310,11197,Bulker,Y,
China,CPM Corporation Limited ,Sino South,8306670,Panama,"Jiangyin, China",Vasteast International Private Limited ,Sinosouth Shipping Company Limited ,1984,unknown,unknown,Bulker,N,
China,Fu Long Marine Shipping Company Limited ,Frio Spain,8303903,Panama,"Jiangyin, China",Fu Long Marine Shipping Company Limited ,Ocean Tradewinds Limited ,1983,unknown,unknown,Reefer,Y,
China,Guangzhou Kuifenghang Shipping Company Limited ,First Sino,8028577,Panama,"Jiangyin, China",Guangzhou Kuifenghang Shipping Company Limited ,Hong Kong (First Sino) Shipping Limited ,1983,unknown,unknown,General cargo ship,Y,
China,Langjiang Shipping Incorporated ,Lang Jiang,8213689,Panama,"Jiangyin, China",Langjiang Shipping Incorporated ,Langjiang Shipping Incorporated ,1983,unknown,2859,General cargo ship,Y,
China,Ningbo Shanglun Shipmanagement Company Limited ,Grand,8102256,Panama,"Jiangyin, China",Ningbo Shanglun Shipmanagement Company Limited ,Well Successful Shipping Company Limited ,1982,unknown,12118,Bulker,Y,
China,Sino Far East Ship Management Company Limited ,Luyang Hongkong,8010881,Panama,"Jiangyin, China",Sino Far East Ship Management Company Limited ,Sea Best Limited ,1981,375,11725,Bulker,Y,
Croatia,Losinjska Plovidba Brodarstvo d.o.o. ,Danica,8113372,St Vincent & Grenadines,"Jiangyin, China",Losinjska Plovidba Brodarstvo d.o.o. ,Tramontana Maritime Incorporated ,1983,unknown,unknown,Bulker,Y,
Cyprus,SMT Shipmanagement & Transport Limited ,Merchant,7516632,Bahamas,"Jiangyin, China",SMT Shipmanagement & Transport Limited ,Merchant Shipping Limited ,1977,439,13613,General cargo ship,Y,
Cyprus,SMT Shipmanagement & Transport Limited ,Musketeer,7516656,Bahamas,"Jiangyin, China",SMT Shipmanagement & Transport Limited ,Musketeer Shipping Limited ,1977,unknown,unknown,General cargo ship,Y,
