China,Shanghai Jinhai Shipping & Trading Company Limited ,Jin Hai Shun,8402046,China,China,Shanghai Jinhai Shipping & Trading Company Limited ,Shanghai Jinhai Shipping & Trading Company Limited ,1984,unknown,unknown,Chemical Tanker,N,
China,Xinao Marine Shipping Company Limited ,Qi Xing,8108925,China,China,Xinao Marine Shipping Company Limited ,Xinao Energy Shipping Company Limited ,1981,unknown,unknown,LPG Tanker,Y,
China,China National Offshore Oil Corporation (CNOOC) ,Bin Hai 244,8222886,Spain,China,China Oilfield Services Limited (COSL) ,China Oilfield Services Limited (COSL) ,1984,unknown,unknown,Tug,Y,
Hong Kong,Sinotrans CSC Group Company Limited ,Lian Shun,8018077,China,China,Sinotrans CSC Group Company Limited ,Nanjing Changjiang LPG Transportation & Trade Company Limited ,1981,unknown,unknown,LPG Tanker,Y,
Vietnam,Bien Dong Shipping Company ,Sunny Viship,8111245,Mongolia,China,Bien Dong Shipping Company ,Vinashin Shipping Joint Stock Company (VISHIP) ,1982,322,11605,Bulker,Y,
Australia,Australian River Company ,Rover ,8018144,Sierra Leone,"Chittagong, Bangladesh",Australian River Company ,Australian River Company ,1983,unknown,unknown,Bulker,Y,
Bahamas,Clipper Group (Management) Limited,Scotia Prince,7119836,Bahamas,"Chittagong, Bangladesh",Clipper Group (Management) Limited,Scotia Cruise Owner Limited ,1972,430,6963,Passenger ship/RoRo,Y,
Bahamas,Teekay Corporation,Avion,9020687,Comoros,"Chittagong, Bangladesh",Teekay Navion Offshore Loading Private Limited ,Teekay Navion Offshore Loading Private Limited ,1992,435,unknown,Crude Oil Tanker,N,
Bahamas,Teekay Corporation,Avon,9012317,St Kitts-Nevis,"Chittagong, Bangladesh",Teekay Navion Offshore Loading Private Limited ,Teekay Navion Offshore Loading Private Limited ,1992,unknown,unknown,Crude Oil Tanker,N,
Bahamas,Teekay Corporation ,Piri,9041746,St Kitts-Nevis,"Chittagong, Bangladesh",Teekay Navion Offshore Loading Private Limited ,Teekay Navion Offshore Loading Private Limited ,1994,unknown,unknown,Crude Oil Tanker,N,
Bangladesh,HRC Shipping Limited,Banga Bijoy,8123107,Bangladesh,"Chittagong, Bangladesh",HRC Shipping Limited,HRC Shipping Limited,1983,unknown,unknown,Containership,Y,
Bangladesh,HRC Shipping Limited,Banga Borak,8201935,Bangladesh,"Chittagong, Bangladesh",HRC Shipping Limited,HRC Shipping Limited,1984,unknown,unknown,Containership,Y,
Bangladesh,Ratanpur Shipping Lines Limited ,Ratan Pearl,8602373,Bangladesh,"Chittagong, Bangladesh",Ratanpur Shipping Lines Limited ,Ratanpur Shipping Lines Limited ,1988,unknown,unknown,Containership,Y,
Bangladesh,Rubya Shipping Lines Ltd,Noor-1,8907278,Bangladesh,"Chittagong, Bangladesh",Rubya Shipping Lines Ltd,Rubya Shipping Lines Ltd,1990,unknown,unknown,Chemical Tanker,Y,
Bangladesh,AK Ship Management & Services (Private) Limited ,Sarim,7507320,Hong Kong,"Chittagong, Bangladesh",AK Ship Management & Services (Private) Limited ,Sarim Shipping Limited ,1976,unknown,unknown,Bulker,Y,
Bermuda,Ship Finance International Limited,Front Rider,9002764,Singapore,"Chittagong, Bangladesh",Ship Finance International Limited,Blizana Private Limited ,1992,440,23473,Bulker,N,
Brazil,Companhia de Navegacao Norsul S.A.,Santos,8128652,Panama,"Chittagong, Bangladesh",Companhia de Navegacao Norsul S.A.,Companhia de Navegacao Norsul S.A.,1984,unknown,unknown,Bulker,N,
China,Shanghai CP International Ship Management & Broker Company Limited ,Hua Tuo,8218562,China,"Chittagong, Bangladesh",Shanghai CP International Ship Management & Broker Company Limited ,Pearl Bridge Shipping Company Limited ,1983,unknown,7777,General cargo ship,Y,
China,Five Stars Global Shipping (Group) Company,Star,8013546,Comoros,"Chittagong, Bangladesh",Fuzhou Hanxing Ship Management Company Limited ,Linkgo International Holdings Limited ,1982,385,10952,Bulker,Y,
China,Centrans Ocean Shipping Logistics Group ,Sky Jupiter,8308719,Hong Kong,"Chittagong, Bangladesh",Tianjin Centrans Shipping Management Company Limited ,Jupiter Shipping Company Limited ,1985,unknown,unknown,Containership,Y,
China,Hebei Ocean Shipping Company Limited (HOSCO),Hebei Ambition,8715651,Hong Kong,"Chittagong, Bangladesh",Hebei Ocean Shipping Company Limited (HOSCO),Hebei Ambition Shipping Company Limited ,1990,480,38720,Bulk ore carrier,Y,
China,Hebei Ocean Shipping Company Limited (HOSCO),Hebei Forest,8807789,Hong Kong,"Chittagong, Bangladesh",Hebei Ocean Shipping Company Limited (HOSCO),NCS Forest Shipping Company Limited ,1989,505,17198,Bulker,Y,
China,Hebei Ocean Shipping Company Limited (HOSCO),Hebei Loyalty,8420062,Hong Kong,"Chittagong, Bangladesh",Hebei Ocean Shipping Company Limited (HOSCO),Hebei Loyalty Shipping Company Limited ,1987,460,25658,Bulker,N,
China,Hebei Ocean Shipping Company Limited (HOSCO) ,Hebei Peace,7827718,Hong Kong,"Chittagong, Bangladesh",Hebei Ocean Shipping Company Limited (HOSCO) ,Hebei Peace Shipping Company Limited ,1981,unknown,4957,General cargo ship,Y,
China,Hebei Ocean Shipping Company Limited (HOSCO) ,Hebei Pride,8910110,Hong Kong,"Chittagong, Bangladesh",Hebei Ocean Shipping Company Limited (HOSCO) ,Hebei Ocean Shipping Company Limited (HOSCO) ,1991,485,20624,Bulk ore carrier,N,
China,Hebei Ocean Shipping Company Limited (HOSCO),Ocean Mercy,7915620,Hong Kong,"Chittagong, Bangladesh",Hebei Ocean Shipping Company Limited (HOSCO),NCS Pearl Shipping Company Limited ,1987,490,23852,Bulker,N,
China,Hebei Ocean Shipping Company Limited (HOSCO) ,Sea Glory,9034640,Hong Kong,"Chittagong, Bangladesh",Hebei Ocean Shipping Company Limited (HOSCO) ,Ocean Champion Maritime Company Limited ,1993,435,41402,Crude Oil Tanker,N,
China,Tianjin Zhongtong Marine Shipping Company Limited,Alex P,9081150,Hong Kong,"Chittagong, Bangladesh",Tianjin Zhongtong Marine Shipping Company Limited,Rubin Grace (HK) Limited ,1995,400,unknown,Bulker,Y,
China,ATL Shipping Limited,Bintan Star,7915656,Panama,"Chittagong, Bangladesh",ATL Shipping Limited,Laire Overseas Incorporated ,1984,unknown,unknown,Bulker,Y,
China,China Ocean Shipping (Group) Company (COSCO) ,Glorysun,7925364,Panama,"Chittagong, Bangladesh",COSCO Shanghai Ship Management Company Limited (COSHIPMAN) ,Saint Glory Shipping Limited ,1982,440,13966,Bulker,Y,
China,Dragon Carriers ,Good Hope,8214695,Panama,"Chittagong, Bangladesh",Dragon Carriers ,Dragon Carriers ,1984,425,12944,Bulker,N,
China,Dragon Wealth Shipping Limited ,Kang Hua,8128092,Panama,"Chittagong, Bangladesh",Dragon Wealth Shipping Limited ,Automated Shipping Limited ,1983,493,9239,Bulker,Y,
China,Dragon Wealth Shipping Limited ,Xin Hua,8103834,Panama,"Chittagong, Bangladesh",Dragon Wealth Shipping Limited ,Good Trend Shipping Limited ,1982,457,7382,Bulker,N,
China,Fitway Ship Management Limited,Safe Rise,7914080,Panama,"Chittagong, Bangladesh",Fitway Ship Management Limited,Hero Shipping Company Limited ,1980,411,5044,Bulker,Y,
China,Fuzhou Minlun Shipping Co Lt,Wan Jia,7903017,Panama,"Chittagong, Bangladesh",Fuzhou Minlun Shipping Co Lt,Mega Well Shipping Limited ,1979,unknown,unknown,Bulker,N,
China,Harmony Growing Ship Management Company Limited,Hai Yuan,8105272,Panama,"Chittagong, Bangladesh",Harmony Growing Ship Management Company Limited,Hai Yuan Shipping Limited ,1982,404,7720,Bulker,N,
China,Hengfa Shipping Incorporated,Ocean Lovely,8217520,Panama,"Chittagong, Bangladesh",Hengfa Shipping Incorporated,Ocean Lovely Shipping Limited ,1984,407,8360,Bulker,Y,
China,Hengyuan Shipmanagement International ,Ever Bright,8224652,Panama,"Chittagong, Bangladesh",Hengyuan Shipmanagement International ,Ever Bright Shipping Company Limited ,1987,492,24515,Bulker,Y,
China,Jian Mao International Shipping Company,Wan Da,8010893,Panama,"Chittagong, Bangladesh",Jian Mao International Shipping Company,Hua San International Shipping Limited ,1982,460,11725,Bulker,Y,
China,Nanjing Hua Hai Shipping Company Limited,Hua Jin Xiang,7929255,Panama,"Chittagong, Bangladesh",Nanjing Hua Hai Shipping Company Limited,HK Huajinxiang Shipping Company Limited ,1981,396,11217,Bulker,Y,
China,Nanjing Ocean Shipping Company Limited,Heng Shun Xing,8028876,Panama,"Chittagong, Bangladesh",Nanjing Ocean Shipping Company Limited,HSX Shipping Incorporated ,1983,360,9168,Bulker,N,
China,Nanjing Ocean Shipping Company Limited ,Yong Xiang Men,8103468,Panama,"Chittagong, Bangladesh",Nanjing Ocean Shipping Company Limited ,YXM Shipping Company Limited ,1982,unknown,unknown,Bulker,Y,
China,New Shanghai Shipping Company Limited ,New Coast,8319938,Panama,"Chittagong, Bangladesh",New Shanghai Shipping Company Limited ,Original Victory Holdings Limited ,1986,unknown,unknown,Bulker,N,
China,Oriental Ocean Shipping Holding Private Limited,Welwind,8906999,Panama,"Chittagong, Bangladesh",Oriental Ocean Shipping Holding Private Limited,Hongyuan Shipping Private Limited ,1993,448,unknown,Bulk ore carrier,Y,
China,Sea Star Ships Management Company Limited,Glory Fuzhou,8719126,Panama,"Chittagong, Bangladesh",Sea Star Ships Management Company Limited,Glory Fuzhou Limited ,1989,484,24289,Bulker,N,
China,Sea Star Ships Management Company Limited,Glory Rizhao,8906860,Panama,"Chittagong, Bangladesh",Sea Star Ships Management Company Limited,Glory Rizhao Limited ,1991,484,23269,Bulk and oil carrier,N,
China,Wei Fong Shipping Company Limited,Wei Sheng,7715977,Panama,"Chittagong, Bangladesh",Wei Fong Shipping Company Limited,Wei Fong Shipping Company Limited,1978,385,3764,Bulker,Y,
China,Jiangsu Huaxi Group Corporation,Golden Huahai,8109242,Sierra Leone,"Chittagong, Bangladesh",Jiangsu Steamship Company Limited ,Golden Huaren Shipping Company Limited ,1983,unknown,unknown,Bulker,Y,
China,ATL Shipping Limited,Gina,8312174,St Kitts-Nevis,"Chittagong, Bangladesh",ATL Shipping Limited,Gayard Enterprises Corporation ,1984,410,9210,Bulker,Y,
China,Mindong Congmao Shipping Industrial Company Limited ,Bina-21,8617419,St Kitts-Nevis,"Chittagong, Bangladesh",Mindong Congmao Shipping Industrial Company Limited ,Mindong Congmao Shipping Industrial Company Limited ,1990,320,19274,Bulker,N,
China,Nanjing Ocean Shipping Company Limited ,Sin Ocean,8005898,St Vincent & Grenadines,"Chittagong, Bangladesh",Nanjing Ocean Shipping Company Limited ,Sin Ocean Shipping Incorporated ,1981,375,7691,Bulker,Y,
Cyprus,SMT Shipmanagement & Transport Limited ,Ice Pearl,7711581,Bahamas,"Chittagong, Bangladesh",SMT Shipmanagement & Transport Limited ,Ice Pearl Shipping Company Limited ,1980,unknown,12253,General Cargo ship,N,
Denmark,Container Leasing A/S ,CS Christine,9031466,Malta,"Chittagong, Bangladesh",Container Shipping A/S ,Partrederiet Christine ,1992,435,6930,Containership,Y,
Germany,Thien & Heyenga Bereederungs- und Befrachtungs GmbH,Hudson Bay,8202654,Antigua & Barbuda,"Chittagong, Bangladesh",Thien & Heyenga Bereederungs- und Befrachtungs GmbH,Thien & Heyenga Bereederungs- und Befrachtungs GmbH,1983,465,8945,Reefer,Y,
Germany,Conti Holding GmbH & Company KG ,Ion,9064853,Comoros,"Chittagong, Bangladesh",NSB Niederelbe Schiffahrtsgesellschaft mbH & Company KG ,Northern Pioneer (Liberia) Shipping Limited ,1994,unknown,12998,Containership,Y,
Germany,Rickmers Reederei GmbH & Cie KG,Vestfold,9031052,Comoros,"Chittagong, Bangladesh",Rickmers Shipmanagement (Singapore) Private Limited ,Wind Craft One Limited ,1992,440,8228,Containership,Y,
Germany,Johann M.K. Blumenthal GmbH & Company KG Reederei,Katsuragi Maru,8416138,Liberia,"Chittagong, Bangladesh",Johann M.K. Blumenthal GmbH & Company KG Reederei,Johann M.K. Blumenthal GmbH & Company KG Reederei,1986,490,23800,Bulker,Y,
Germany,Conti Holding GmbH & Company KG ,Conti Hong Kong,8808587,Marshall Islands,"Chittagong, Bangladesh",NSB Niederelbe Schiffahrtsgesellschaft mbH & Company KG ,Conti Condor Seetransporte GmbH & Company Reederei KG ms Conti Hong Kong ,1989,unknown,unknown,Containership,N,
Germany,Norddeutsche Vermogen Holding GmbH & Company ,Faith,9064877,St Kitts-Nevis,"Chittagong, Bangladesh",Norddeutsche Vermogensanlage GmbH & Company KG ,Beteiligungs KG ms Northern Faith Schiffahrts GmbH & Company,1994,402,13128,Containership,Y,
Greece,Alcyon Shipping Company Limited,Nightwhisper,8309177,Bahamas,"Chittagong, Bangladesh",Alcyon Shipping Company Limited,Nightwhisper Shipping Company Limited ,1985,430,32761,Bulker,Y,
Greece,Chartworld Shipping Corporation,Amber Star,8420139,Bahamas,"Chittagong, Bangladesh",Chartworld Shipping Corporation,Pretty Ruby Marine Limited ,1986,490,2300,Bulker,Y,
Greece,Callitsis Ship Management S.A.,Athanasios G.Callitsis,8101953,Cyprus,"Chittagong, Bangladesh",Callitsis Ship Management S.A.,Callitsis Ship Management S.A.,1983,415,7990,Bulker,N,
Greece,Hellenic Star Shipping Company S.A. ,Liberty Star,7618454,Cyprus,"Chittagong, Bangladesh",Hellenic Star Shipping Company S.A. ,Liberty Star Shipping Company Limited ,1986,390,10942,Bulker,Y,
Greece,Oceanmaris Management Incorporated ,Angola,8701064,Cyprus,"Chittagong, Bangladesh",Oceanstar Management Incorporated ,Eliane Shipping S.A. ,1987,460,7528,General Cargo ship,Y,
Greece,Perosea Shipping Company S.A. ,Eagle,8126408,Cyprus,"Chittagong, Bangladesh",Perosea Shipping Company S.A. ,Crolier Shipping Limited ,1985,unknown,9422,Bulker,Y,
Greece,Spianada Shipmanagement Company ,Smaragda,8114728,Cyprus,"Chittagong, Bangladesh",Spianada Shipmanagement Company ,Pela Maritime S.A. ,1984,unknown,unknown,Bulker,Y,
Greece,Polembros Shipping Limited,Leon V,8600569,Dominica,"Chittagong, Bangladesh",Polembros Shipping Limited,Silverstone Enterprises Corporation ,1987,385,18080,Bulker,Y,
Greece,Ranger Marine S.A. ,Heron,8316297,Greece,"Chittagong, Bangladesh",Ranger Marine S.A. ,Heron Maritime S.A. ,1984,495,7324,Bulker,Y,
Greece,Z. & G. Halcoussis Company Limited,Alexandria,8004181,Greece,"Chittagong, Bangladesh",Z. & G. Halcoussis Company Limited,Alexandria Maritime Incorporated,1981,unknown,6384,Bulker,Y,
Greece,A. Ships Management Incorporated,United ,9071686,Liberia,"Chittagong, Bangladesh",A. Ships Management Incorporated,Kamtchuka Enterprises Limited ,1993,448,13755,Bulker,Y,
Greece,Centrofin Management Incorporated,Ce-Ulsan,8806527,Liberia,"Chittagong, Bangladesh",Centrofin Management Incorporated,Stamford Marine Incorporated ,1990,480,18311,Crude Oil Tanker,N,
Greece,Coronis Shipping Company Limited,Ilenao,8322533,Liberia,"Chittagong, Bangladesh",Carras (Hellas) Limited ,Poseidon Shipping & Trading Company Limited ,1987,435,11525,Bulker,Y,
Greece,DND Management Incorporated,Lovestar II,8309359,Liberia,"Chittagong, Bangladesh",DND Management Incorporated,Triple Eight Shipping Company ,1984,475,8026,Bulker,Y,
Greece,GrandUnion Incorporated,Australia,9031272,Liberia,"Chittagong, Bangladesh",NewLead Holdings Limited,Australia Holdings Limited ,1993,unknown,27230,Bulker,Y,
Greece,Lavinia Corporation Limited,Antarctic Star,8301682,Liberia,"Chittagong, Bangladesh",Lavinia Corporation Limited,Carmel Seaways Limited ,1983,320,3802,Reefer,Y,
Greece,Polembros Shipping Limited ,Kassos Warrior,8408703,Liberia,"Chittagong, Bangladesh",Polembros Shipping Limited ,Diamond Port Shipping Corporation ,1986,450,23579,Bulker,N,
Greece,Tsakos Shipping and Trading S.A. ,MSC Sardinia,8502896,Liberia,"Chittagong, Bangladesh",Tsakos Shipping and Trading S.A. ,Maribel Shipping Corporation ,1986,408,13128,Containership,Y,
Greece,Worldwide Green Tankers Limited ,Great News,8208347,Liberia,"Chittagong, Bangladesh",Worldwide Green Tankers Limited ,Sea Ventures Shipping Limited ,1984,unknown,13676,Tanker,N,
Greece,A.B. Maritime Incorporated,Stelios B.,8309878,Malta,"Chittagong, Bangladesh",A.B. Maritime Incorporated,Stelios B. Maritime Limited ,1985,408,9261,Bulker,Y,
Greece,Blossom Maritime Corporation,C. Symphony,8315102,Malta,"Chittagong, Bangladesh",Blossom Maritime Corporation,Music Maritime Limited ,1985,unknown,7630,Bulker,Y,
Greece,Delta International Shipping Company S.A.,Laconia,8517578,Malta,"Chittagong, Bangladesh",Delta International Shipping Company S.A.,Possidonia Maritime Company Limited ,1987,428,10614,Bulker,Y,
Greece,Dragnis Group ,Limnos,9053775,Malta,"Chittagong, Bangladesh",Goldenport Shipmanagement Limited ,Serena Navigation Limited ,1992,415,13420,Bulker,Y,
Greece,Dragnis Group ,Lindos,8922383,Malta,"Chittagong, Bangladesh",Goldenport Shipmanagement Limited ,Black Diamond Shipping Limited ,1990,394,13720,Bulker,Y,
Greece,Kristen Marine S.A.,Ocean Ranger,8221959,Malta,"Chittagong, Bangladesh",Kristen Marine S.A.,Ocean Ranger Nav. Company Limited ,1983,396,7244,Bulker,Y,
Greece,Alison Management Corporation ,Seacrest,9000522,Marshall Islands,"Chittagong, Bangladesh",Alison Management Corporation ,Natural Trading Incorporated ,1991,475,20179,Crude Oil Tanker,N,
Greece,Alison Management Corporation ,Goldwing,9000560,Marshall Islands,"Chittagong, Bangladesh",Alison Management Corporation ,Solemar Shipmanagement Limited ,1991,510,20514,Crude Oil Tanker,N,
Greece,Alison Management Corporation ,Low Rider,9000508,Marshall Islands,"Chittagong, Bangladesh",Alison Management Corporation ,Selas Management Company ,1991,510,20187,Crude Oil Tanker,N,
Greece,Antares Shipmanagement S.A. ,Reunion,8907917,Marshall Islands,"Chittagong, Bangladesh",Antares Shipmanagement S.A. ,Reunion Shipping S.A. ,1991,397,17353,Bulker,Y,
Greece,Iason Hellenic Shipping Company Limited ,Caravos Horizon,8419257,Marshall Islands,"Chittagong, Bangladesh",Iason Hellenic Shipping Company Limited ,Regency Maritime Limited ,1985,unknown,9907,Bulker,Y,
Greece,Quantum Shipping Limited,Panostar,8102000,Marshall Islands,"Chittagong, Bangladesh",Quantum Shipping Limited,Picture Maritime Corporation ,1984,432,12500,Bulker,N,
Greece,Sitinas Shipping Company S.A. ,Nava Eliza,8312045,Marshall Islands,"Chittagong, Bangladesh",Sitinas Shipping Company S.A. ,Eliza Marine Company ,1984,unknown,9094,Bulker,Y,
Greece,Andrico Maritime Company S.A.,Krikelo,8307222,Panama,"Chittagong, Bangladesh",Andrico Maritime Company S.A.,Krikelo Shipping S.A. ,1985,unknown,7922,Bulker,Y,
Greece,Atlantic Bulk Carriers Management Limited,Oceanline 1,7622778,Panama,"Chittagong, Bangladesh",Atlantic Bulk Carriers Management Limited,Middlesbrough Shipping & Investment Limited ,1978,415,7512,Bulker,Y,
Greece,Dragnis Group ,Bosporus Bridge,9043768,Panama,"Chittagong, Bangladesh",Goldenport Shipmanagement Limited ,Breaport Maritime S.A. ,1993,unknown,17720,Containership,Y,
Greece,European Navigation Incorporated,Eleftheria K.,8406418,Panama,"Chittagong, Bangladesh",European Navigation Incorporated,Milford Seacarriers S.A. ,1985,395,26048,Bulker,Y,
Greece,Excel Maritime Carriers Limited ,Attractive,8307595,Panama,"Chittagong, Bangladesh",Excel Maritime Carriers Limited ,Excel Maritime Carriers Limited ,1985,408,7468,Bulker,Y,
Greece,Fairport Shipping Limited,Troy,8029521,Panama,"Chittagong, Bangladesh",Fairport Shipping Limited,Global Dominion S.A. ,1981,435,5216,Bulker,Y,
Greece,Kouros Maritime Enterprises Incorporated,Joanna A.,8202513,Panama,"Chittagong, Bangladesh",Kouros Maritime Enterprises Incorporated,Troyan Maritime Limited ,1985,424,8020,Bulker,Y,
Greece,Lavinia Corporation Limited ,Frio Hamburg,8807478,Panama,"Chittagong, Bangladesh",Lavinia Corporation Limited ,Seaview Maritime S.A. ,1988,320,3230,Reefer,N,
Greece,Pendulum Shipmanagement Incorporated,Spring Breeze I,8026139,Panama,"Chittagong, Bangladesh",Pendulum Shipmanagement Incorporated,Rejoy Shipping Company Limited ,1984,425,7415,Bulker,Y,
Greece,The Frangos-Moundreas Group ,Krissa,7626504,Panama,"Chittagong, Bangladesh",Good Faith Shipping Company S.A. ,Shelby Marine Corporation ,1979,unknown,5653,Bulker,Y,
Greece,Trustoil Tankers S.A.,Trust Integrity,9002233,Panama,"Chittagong, Bangladesh",Trustoil Tankers S.A.,Delice Marine Limited ,1992,517,15379,Bulk and Oil Carrier,N,
Greece,Tsakos Shipping and Trading S.A.,Sydney,8606329,Panama,"Chittagong, Bangladesh",Tsakos Shipping and Trading S.A.,Wicklow Shipping Company Limited ,1987,496,23019,Bulker,Y,
Greece,Everlast Shipping S.A.,Runner 1,9000182,St Kitts-Nevis,"Chittagong, Bangladesh",Everlast Shipping S.A.,Eldorado Shipholding Company ,1993,400,22520,Bulker,N,
Greece,GrandUnion Incorporated ,Saint Vladimir,8111958,St Kitts-Nevis,"Chittagong, Bangladesh",GrandUnion Incorporated ,Grand Anemi Limited ,1988,unknown,unknown,Bulker,Y,
Greece,Dianik Bross Shipping Corporation S.A.,Steel Andronikos,8103236,St Vincent & Grenadines,"Chittagong, Bangladesh",Dianik Bross Shipping Corporation S.A.,Noma Maritime & Holdings S.A. ,1982,473,9667,Bulker,Y,
Greece,Polembros Shipping Limited,Alina II,8406896,St Vincent & Grenadines,"Chittagong, Bangladesh",Polembros Shipping Limited,Pompey Shipping Corporation ,1986,490,22083,Bulker,Y,
Hong Kong,Hong Xiang Shipping Holding (Hong Kong) Company Limited,Gold Star,8221674,Hong Kong,"Chittagong, Bangladesh",Hong Xiang Shipping Holding (Hong Kong) Company Limited,Gold Star Shipping Limited ,1984,unknown,unknown,Bulker,Y,
Hong Kong,Univan Ship Management Limited ,Hong Kong Sun,8208206,Hong Kong,"Chittagong, Bangladesh",Univan Ship Management Limited ,Capital Basin Limited ,1984,390,6203,Bulker,N,
Hong Kong,Auspicious Shipping Limited ,Byford,8024911,Panama,"Chittagong, Bangladesh",Auspicious Shipping Limited ,Byford Shipping Limited ,1981,unknown,unknown,Bulker,N,
Hong Kong,Ever Glory Maritime Company Limited,Hyperlink,8112055,Panama,"Chittagong, Bangladesh",Ever Glory Shipping Enterprises Company Limited ,Zenith Shipping Limited ,1983,455,10132,Bulker,Y,
Hong Kong,Fujian Marine Company Limited,Bestking,8107555,Panama,"Chittagong, Bangladesh",Fujian Marine Company Limited,Bothwell Shipping Limited ,1983,470,7933,Bulker,Y,
Hong Kong,Haistar Maritime Company Limited,Flourish,8723610,Panama,"Chittagong, Bangladesh",Ocean Star Shipping (Hong Kong) Company Limited ,Haistar Shipping Limited ,1988,392,13350,Bulker,Y,
Hong Kong,Jinhui Shipping & Transportation Limited ,Mei Hua,7526601,Panama,"Chittagong, Bangladesh",Goldbeam International Limited ,Huafeng Shipping Incorporated ,1982,unknown,17082,Bulker,Y,
Hong Kong,Weilan Navigation Group Company Limited ,Zhong Hang 1,8000472,Panama,"Chittagong, Bangladesh",Weilan Navigation Group Company Limited ,Weilan Navigation Group Company Limited ,1982,421,12074,Bulker,Y,
Hong Kong,Hua Yang International Marine,Golden Hua Yi,8002767,Sierra Leone,"Chittagong, Bangladesh",Hua Yang International Marine,Grand Wide Shipping Limited ,1981,unknown,unknown,Bulker,Y,
India,The Shipping Corporation of India Limited,Andakini,8321058,Comoros,"Chittagong, Bangladesh",The Shipping Corporation of India Limited,The Shipping Corporation of India Limited,1986,unknown,unknown,Bulker,Y,
India,Eastern Bulk Company Limited,Rising Glory,8828915,India,"Chittagong, Bangladesh",Eastern Bulk Company Limited,Eastern Bulk Company Limited,1985,unknown,unknown,General cargo ship,Y,
India,Gati Limited ,Gati Zipp,8223531,India,"Chittagong, Bangladesh",Gati Coast-to-Coast ,Gati Limited ,1983,unknown,unknown,General cargo ship,Y,
India,Goodearth Maritime Limited,Good Union,9071715,India,"Chittagong, Bangladesh",Goodearth Maritime Limited,Goodearth Maritime Limited,1994,495,13420,Bulker,Y,
India,PFS Shipping (India) Limited,PFS Narayana,8130667,India,"Chittagong, Bangladesh",PFS Shipping (India) Limited,PFS Shipping (India) Limited,1983,unknown,unknown,Bulker,N,
India,Rarefield Shipping Private Limited,Elsin Rani,9065900,India,"Chittagong, Bangladesh",Rarefield Shipping Private Limited,Rarefield Shipping Incorporated ,1994,465,4255,General cargo ship ,Y,
India,Rarefield Shipping Private Limited,Russel Rani,9080170,India,"Chittagong, Bangladesh",Rarefield Shipping Private Limited,Rarefield Shipping Incorporated ,1995,unknown,unknown,General cargo ship ,Y,
India,Seven Islands Shipping Limited,Triumph,8118401,India,"Chittagong, Bangladesh",Seven Islands Shipping Limited,Seven Islands Shipping Limited,1984,425,10118,Product Tanker,N,
India,The Shipping Corporation of India Limited ,Sagar,8409783,Tuvalu,"Chittagong, Bangladesh",The Shipping Corporation of India Limited ,The Shipping Corporation of India Limited ,1987,unknown,10275,Bulker ,Y,
Indonesia,Bina Surya Group,Prosperous,8005094,Indonesia,"Chittagong, Bangladesh","Arpeni Pratama Ocean Line, P.T. Perusahaan Pelayaran Samudera Khusus (APOL) ",Prosperous Ships Holding Limited ,1982,456,10963,Bulker ,Y,
Indonesia,P.T. Cakra Bahana,Temasek,8108901,Indonesia,"Chittagong, Bangladesh",PT Cakra Bahana,PT Cakra Bahana,1982,378,unknown,Product Tanker,Y,
Indonesia,P.T. Pelayaran Tempuran Emas Tbk. ,Curug Mas,8022640,Indonesia,"Chittagong, Bangladesh",P.T. Pelayaran Tempuran Emas Tbk. ,P.T. Pelayaran Tempuran Emas Tbk. ,1982,unknown,2371,General Cargo ship,Y,
Indonesia,P.T. Pelayaran Tempuran Emas Tbk. ,Umbul Mas,7349845,Indonesia,"Chittagong, Bangladesh",P.T. Pelayaran Tempuran Emas Tbk. ,P.T. Pelayaran Tempuran Emas Tbk. ,1974,unknown,unknown,Containership,N,
Indonesia,P.T. Samudera Sukses Makmur ,Bogasari Dua,7613985,Indonesia,"Chittagong, Bangladesh",P.T. Samudera Sukses Makmur ,P.T. Samudera Sukses Makmur ,1977,415,7926,Bulker,N,
Indonesia,P.T. Berlian Laju Tanker Tbk. ,Anggraini,9018696,Singapore,"Chittagong, Bangladesh",P.T. Berlian Laju Tanker Tbk. ,Fatmarini Maritime Private Limited ,1995,517,10830,Chemical and Oil tanker,N,
Indonesia,P.T. Berlian Laju Tanker Tbk.,Jas,9117234,St Kitts-Nevis,"Chittagong, Bangladesh",P.T. Berlian Laju Tanker Tbk.,Anjasmoro Marine Private Limited ,1996,490,10830,Chemical and Oil tanker,N,
Italy,BM Shipping Group S.p.A.,Intrepid,8209755,Comoros,"Chittagong, Bangladesh",BM Shipping Group S.p.A.,BM Shipping Group S.p.A.,1983,462,5940,General Cargo ship,N,
Italy,BM Shipping Group S.p.A.,BM Hope,7618284,Panama,"Chittagong, Bangladesh",BM Shipping Group S.p.A.,BM Shipping Group S.p.A.,1978,462,7933,Bulker,Y,
Italy,BM Shipping Group S.p.A. ,BM Warrior,8412534,Panama,"Chittagong, Bangladesh",BM Shipping Group S.p.A. ,BM Shipping Group S.p.A. ,1986,unknown,5489,General Cargo ship,N,
Italy,Siba S.p.A.,Ocean Shearer,7810935,Panama,"Chittagong, Bangladesh",Siba S.p.A.,Wellard Ships Private Limited ,1981,unknown,21588,Livestock carrier,Y,
