4545979,REVI,Anchor Handling Tug Supply,1000,,1985,France,,France Govt,France,France Govt Marine Nationale,France Govt Marine Nationale,France,Unknown,Unknown,2021-05-01 00:00:00,,,
8805509,NIKA,Refrigerated Cargo Ship ,2060,1660,1987,Togo,Georgia,Georgian Industrial Asset Management,Georgia,Malva Shipping & Engineering,Sky Halley Inc,Panama,Aliaga,Turkey,2021-05-01 00:00:00,,,
8908569,SEA LION,LPG Tanker,7955,5140,1996,St Kitts & Nevis,Liberia,Hartmann AG,Germany,GasChem Services GmbH & Co KG,Gaschem Ice GmbH & Co KG,Germany,Alang,India,2021-05-01 00:00:00,,,
9144794,CE-NIRIIS,Crude Oil Tanker,56127,16337,1998,Marshall Islands,,Centrofin Management Inc,Greece,Marine Trust Ltd-MAI,Barnet Marine Inc,Marshall Islands,Chittagong,Bangladesh,2021-05-01 00:00:00,,,
9234484,ELKA GLORY,Chemical/Products Tanker,27612,10365,2003,Liberia,Greece,European Navigation Inc,Greece,European Product Carriers Ltd,Carriage Shipping,Liberia,Gadani,Pakistan,2021-05-01 00:00:00,,,
9249104,ELKA VASSILIKI,Chemical/Products Tanker,55096,17843,2004,Liberia,Greece,European Navigation Inc,Greece,European Product Carriers Ltd,Caldren Corp Ltd,Liberia,Gadani,Pakistan,2021-05-01 00:00:00,,,
8110796,SEA FOS,Anchor Handling Tug Supply,2070,2009,1982,Palau,Malta,Five Oceans Salvage,Greece,Tug Management Services Ltd,Ionian Sea FOS Shipping Ltd,Liberia,Alang,India,2021-05-01 00:00:00,,,
9145853,MR STAR,Products Tanker,27915,10043,1997,Panama,,HSM Products Ltd,Greece,Mega Glory Holdings Ltd-BVI,Evolution Global Co Ltd,Samoa,Chittagong,Bangladesh,2021-05-01 00:00:00,,,
9082740,DONA V,Bulk Carrier,26019,9083,1995,St Kitts & Nevis,,Monte Nero Maritime SA,Greece,Monte Nero Maritime SA,Whakaari Navigation Co SA,Panama,Chittagong,Bangladesh,2021-05-01 00:00:00,,,
9212412,SEA RIDER,Chemical/Products Tanker,23740,8529,2000,Marshall Islands,,Sea World Management & Trading,Greece,Gravo DMCC,Flourish Shipping Co,Marshall Islands,Gadani,Pakistan,2021-05-01 00:00:00,,,
5326306,ANJAN,"Crane Vessel, non propelled",1348,1707,1962,India,,Jayesh Shipping Pvt Ltd,India,Jayesh Shipping Pvt Ltd,Jayesh Shipping Pvt Ltd,India,Alang,India,2021-05-01 00:00:00,,,
8411047,ACHIEVE,Anchor Handling Tug Supply,1558,1523,1985,St Kitts & Nevis,,Pelmar Shipping & Engineering,India,Prayati Shipping Pvt Ltd,Priority Shipping Pte Ltd,Singapore,Alang,India,2021-05-01 00:00:00,,,
9123673,TAG 17,Platform Supply Ship,1969,1425,1996,India,,Tag Offshore Ltd,India,Tag Offshore Ltd,Tag Offshore Ltd,India,Alang,India,2021-05-01 00:00:00,,,
9159660,FREESIA I,Crude Oil Tanker,81265,23159,1998,Panama,,Unknown,India,Darya Shipping Pvt Ltd,Berwen Ventures Corp,Marshall Islands,Chittagong,Bangladesh,2021-05-01 00:00:00,,,
9041411,ONTARI,Products Tanker,12669,4828,1993,Indonesia,,Buana Lintas Lautan Tbk PT,Indonesia,Gemilang Bina Lintas Tirta PT,Mahameru Nusa Mentari PT,Indonesia,Chittagong,Bangladesh,2021-05-01 00:00:00,,,
9165891,ARIRANG,General Cargo Ship,4264,2491,1997,Belize,,Marukichi Commerce Co Ltd,Japan,Marukichi Commerce Co Ltd,Orient Star Lingyun SA,Panama,Chittagong,Bangladesh,2021-05-01 00:00:00,,,
7022356,ENOZ,Livestock Carrier,11958,10600,1970,Palau,Panama,Hijazi & Ghosheh Co,Jordan,Hijazi & Ghosheh Co,Mavar Shipping Corp SA,Panama,Chittagong,Bangladesh,2021-05-01 00:00:00,,,
9128661,MIRACLE ROAD,LPG Tanker,2978,2045,1995,Korea (South),,Duck Yang Shipping Co Ltd,Korea (South),Duck Yang Shipping Co Ltd,Duck Yang Shipping Co Ltd,Korea (South),Chittagong,Bangladesh,2021-05-01 00:00:00,,,
7108899,SAFI,General Cargo Ship,2526,1456,1971,Togo,,Global Management & Trading,Lebanon,Global Management & Trading,Manessa Maritime SA,Honduras,Aliaga,Turkey,2021-05-01 00:00:00,,,
8410914,CHINA FROST,Refrigerated Cargo Ship,4999,3431,1985,Cook Islands,,Ship Service Agency,Lithuania,Ship Service Agency,Lansing Management,Panama,Alang,India,2021-05-01 00:00:00,,,
8766909,MOPU SATU,"Production Platform, jack up",4240,9105,1981,Niue,Malaysia,MISC Bhd,Malaysia,Malaysia Offshore Mobile,Malaysia Offshore Mobile,Malaysia,Chittagong,Bangladesh,2021-05-01 00:00:00,,,
8756007,MOPU DUA,"Production Platform, jack up",4105,8256,1977,Niue,Malaysia,MISC Bhd,Malaysia,Malaysia Offshore Mobile,Malaysia Offshore Mobile,Malaysia,Chittagong,Bangladesh,2021-05-01 00:00:00,,,
7719155,KAMELIA,"FPSO, Oil",63994,23577,1980,Palau,Malaysia,Perisai Petroleum Teknologi,Malaysia,Perisai Petroleum Teknologi,Emas Victoria Labuan Bhd,Malaysia,Gadani,Pakistan,2021-05-01 00:00:00,,,
8129498,GOLDEN EAGLE,General Cargo Ship,5985,2750,1985,Palau,,Mir Shipping Co Ltd,Marshall Islands,Mir Shipping Co Ltd,Mir Shipping Co Ltd,Marshall Islands,Gadani,Pakistan,2021-05-01 00:00:00,,,
9563782,POSH GITANO,Platform Supply Ship,2369,,2010,Panama,,PACC Offshore Mexico SA de CV,Mexico,PACC Offshore Mexico SA de CV,Adara Ltd,British Virgin Islands,Unknown,Mexico,2021-05-01 00:00:00,,,
9410868,POSH GALANTE,Platform Supply Ship,1708,1283,2008,Panama,,PACC Offshore Mexico SA de CV,Mexico,PACC Offshore Mexico SA de CV,Adara Ltd,British Virgin Islands,Unknown,Mexico,2021-05-01 00:00:00,,,
7218395,EDI,Passenger/Cruise,28551,14400,1973,Bahamas,,Fred Olsen & Co,Norway,Fred Olsen Cruise Lines Ltd,Boudicca Cruise Ltd,United Kingdom,Aliaga,Turkey,2021-05-01 00:00:00,,,
7508881,EIDE TRAVELER,Anchor Handling Tug Supply,1389,,1977,Norway,,Marine Contractor AS,Norway,Marine Contractor AS,Marine Contractor AS,Norway,Esbjerg,Denmark,2021-05-01 00:00:00,,,
8308549,REGALIA,"Maintenance Platform, semi Submersible",17624,21030,1985,Unknown,Singapore,Prosafe SE,Norway,Prosafe Offshore Pte Ltd,Prosafe Offshore Pte Ltd,Singapore,Aliaga,Turkey,2021-05-01 00:00:00,,,
9039743,BP JACKY,LPG Tanker,4822,2984,1992,Liberia,,Transgas Shipping Lines SAC,Peru,Transgas Shipping Lines SAC,BP Gastankers Inc,Panama,Chittagong,Bangladesh,2021-05-01 00:00:00,,,
9083158,GSP PHOENIX,Crew/Supply Vessel,2033,1723,1995,Malta,,GSP,Romania,GSP,GSP Phoenix Shipping Ltd,Malta,Aliaga,Turkey,2021-05-01 00:00:00,,,
8107062,GSP VEGA,Anchor Handling Tug Supply,1768,1964,1982,Malta,,GSP,Romania,GSP Offshore Srl,GSP Vega Ltd,Malta,Aliaga,Turkey,2021-05-01 00:00:00,,,
8700101,BELOGORSK,Products Tanker,2966,2184,1988,Palau,Russia,Price Co,Russia,Price Co Ltd,Sky Pacific Ltd,Hong Kong   ,Chittagong,Bangladesh,2021-05-01 00:00:00,,,
9133771,VIKA,Bulk Carrier,25206,9664,1998,Belize,,Sadent Shipping Ltd-CYP,Russia,Victoria Shipping Ltd-BZE,Vlad Shipping Ltd,Belize,Gadani,Pakistan,2021-05-01 00:00:00,,,
7922843,POLARIS,Products Tanker,7462,4777,1981,Russia,,Tekhnotek LLC,Russia,Transoil Co Ltd-Nakhodka,Tekhnotek LLC,Russia,Chittagong,Bangladesh,2021-05-01 00:00:00,,,
9015383,BREU,Products Tanker,2436,,1991,Tanzania (Zanzibar),,Global Energy International,Singapore,GEA-Bravo Pte Ltd,GEA-Bravo Pte Ltd,Singapore,Gadani,Pakistan,2021-05-01 00:00:00,,,
8311106,ICE ROSE,Refrigerated Cargo Ship,12401,6937,1985,Marshall Islands,,Maestro Shipping SA,Switzerland,Maestro Reefers A/S,Ice Rose Shipping Ltd-MAI,Marshall Islands,Alang,India,2021-05-01 00:00:00,,,
8311132,ICE RANGER,Refrigerated Cargo Ship,12411,6931,1985,Marshall Islands,,Maestro Shipping SA,Switzerland,Maestro Reefers A/S,Ice Ranger Shipping Ltd,Marshall Islands,Alang,India,2021-05-01 00:00:00,,,
9110640,FORM-1,Chemical Tanker,19095,7337,1996,Comoros,Taiwan,Formosa Plastics Marine Corp,Taiwan,Formosa Plastics Marine Corp,Formosa Plastics Marine Corp,Taiwan,Chittagong,Bangladesh,2021-05-01 00:00:00,,,
8514435,SHUN LI,Chemical/Products Tanker,4553,2427,1985,Mongolia,,Jin Hao Ship Management Co Ltd,Taiwan,Jin Hao Ship Management Co Ltd,Sun Jazz Marine Pte Ltd,Singapore,Alang,India,2021-05-01 00:00:00,,,
9009528,GLORY,Chemical/Products Tanker,3853,2364,1992,St Kitts & Nevis,Panama,Mega Glory Holdings Ltd-BVI,Taiwan,Mega Glory Holdings Ltd-BVI,Mega Glory Holdings Ltd-BVI,British Virgin Islands,Alang,India,2021-05-01 00:00:00,,,
9178317,FREEMONT,Crude/Oil Products Tanker,56955,16237,1998,Panama,,Mega Glory Holdings Ltd-BVI,Taiwan,Mega Glory Holdings Ltd-BVI,Superb Gold Co Ltd,Seychelles,Chittagong,Bangladesh,2021-05-01 00:00:00,,,
9009530,MEGA,Chemical/Products Tanker,3853,2369,1993,St Kitts & Nevis,,Mega Glory Holdings Ltd-BVI,Taiwan,Mega Glory Holdings Ltd-BVI,Mega Glory Holdings Ltd-BVI,British Virgin Islands,Alang,India,2021-05-01 00:00:00,,,
8920115,SUNWARD,Products Tanker ,3778,2275,1990,Panama,,Wills International Co Ltd,Taiwan,Wills International Co Ltd,Sunward Marine SA,Taiwan,Chittagong,Bangladesh,2021-05-01 00:00:00,,,
8419374,LUCK GROW 888,Products Tanker,4410,2419,1985,Mongolia,,You Young Ship Mgmt & Consult,Taiwan,You Young Ship Mgmt & Consult,Double Gains Co Ltd,Seychelles,Chittagong,Bangladesh,2021-05-01 00:00:00,,,
9085388,OCEAN AMETHYST,Products Tanker,28226,9077,1995,Panama,,Zheng Yu Shipping Co Ltd,Taiwan,Winson Oil Bunkering Pte Ltd,Golden Shelter Ltd,British Virgin Islands,Chittagong,Bangladesh,2021-05-01 00:00:00,,,
7615684,SAMSUN,Passenger/Ro-Ro Ship (Vehicles),10870,6593,1985,Turkey,,Denizciler Turizm Denizcilik,Turkey,Denizciler Turizm Denizcilik,Denizciler Turizm Denizcilik,Turkey,Aliaga,Turkey,2021-05-01 00:00:00,,,
7305772,BIRDEN,Passenger/Ro-Ro Ship (Vehicles/Rail),7504,4337,1973,Comoros,Turkey,Istanbullines Lojistik,Turkey,Istanbullines Lojistik,Hidiv Denizcilik Ltd Sti,Turkey,Gadani,Pakistan,2021-05-01 00:00:00,,,
9004621,GREEN BELT,Products Tanker,3752,2350,1990,Cook Islands,,Al Taawon Shipping Co,United Arab Emirates,Sunrise Shipping FZE,Al Taawon Shipping Co,United Arab Emirates,Gadani,Pakistan,2021-05-01 00:00:00,,,
9125281,DAWN 1,Chemical/Products Tanker,6253,3197,1995,St Kitts & Nevis,Panama,Babil Marine Shipping Serv LLC,United Arab Emirates,AH International Shpg Agent,Link Energy Est,United Arab Emirates,Alang,India,2021-05-01 00:00:00,,,
8403301,NOLLA,Products Tanker,3125,1827,1984,Togo,,Babil Marine Shipping Serv LLC,United Arab Emirates,Adeema Ship Management FZE,Abyssinia Oil & Shpg Co Ltd,St Vincent & The Grenadines,Gadani,Pakistan,2021-05-01 00:00:00,,,
8814328,DARWISH 4,Tug,741,709,1990,Gabon,St Kitts & Nevis,Divers Marine Contracting LLC,United Arab Emirates,Divers Marine Contracting LLC,Divers Marine Contracting LLC,United Arab Emirates,Gadani,Pakistan,2021-05-01 00:00:00,,,
9120891,ASPHALT,Asphalt/Bitumen Tanker,4951,2674,1997,St Kitts & Nevis,Panama,Gulf Petrochem FZC,United Arab Emirates,Celestial Ship Management Pte,GP Asphalt Shipping Inc,Panama,Alang,India,2021-05-01 00:00:00,,,
8602361,CAPTAIN HAMADA,General Cargo Ship,6425,3318,1988,Tanzania (Zanzibar),,Intertek Maritime Middle East,United Arab Emirates,Intertek Maritime Middle East,Al Huda Shipping Co SA,Panama,Gadani,Pakistan,2021-05-01 00:00:00,,,
9179634,ALASFAL,Crude Oil Tanker,43822,16694,2001,Liberia,,Muhit Maritime FZE,United Arab Emirates,Muhit Maritime FZE,Vildiz Marine SA,Liberia,Chittagong,Bangladesh,2021-05-01 00:00:00,,,
7931131,LADY SARAH,Products Tanker,1838,1182,1981,Tanzania (Zanzibar),,Prime Tankers LLC,United Arab Emirates,Prime Tankers LLC,Chahat Shipping Lines Inc,Panama,Alang,India,2021-05-01 00:00:00,,,
8705319,SALMY,Passenger/Ro-Ro Ship (Vehicles),12961,5690,1987,St Kitts & Nevis,United Arab Emirates,Salem Al Makrani Cargo Co,United Arab Emirates,Salem Al Makrani Cargo Co,Salem Al Makrani Cargo Co,United Arab Emirates,Alang,India,2021-05-01 00:00:00,,,
9156591,HUA 1,Crude Oil Tanker,52618,16062,1997,Liberia,,Saud Shipping DMCC,United Arab Emirates,Saud Shipping DMCC,First Global Inc,Liberia,Chittagong,Bangladesh,2021-05-01 00:00:00,,,
8752130,KEY HAWAII,"Drilling Rig, jack up",6832,8818,1983,St Kitts & Nevis,Vanuatu,Shelf Drilling Holdings Ltd,United Arab Emirates,Shelf Drilling Holdings Ltd,Shelf Drilling Key Hawaii Ltd,Cayman Islands,Alang,India,2021-05-01 00:00:00,,,
8751241,GALVESTON KEY,"Drilling Rig, jack up",6100,9382,1978,St Kitts & Nevis,Vanuatu,Shelf Drilling Holdings Ltd,United Arab Emirates,Eckhardt Marine GmbH,Shelf Drilling Intl Inc,Cayman Islands,Alang,India,2021-05-01 00:00:00,,,
8752386,TRIDENT 15,"Drilling Rig, jack up",6164,8202,1982,St Kitts & Nevis,Liberia,Shelf Drilling Holdings Ltd,United Arab Emirates,Transocean Inc,Shelf Drilling Offshore,Cayman Islands,Alang,India,2021-05-01 00:00:00,,,
7514397,KOMMANDOR STUART,Research Survey Vessel,1286,,1976,United Kingdom,,Hays Ships Ltd,United Kingdom,Hays Ships Ltd,Hays Ships Ltd,United Kingdom,Brownsville,United States of America,2021-05-01 00:00:00,,,
9125736,ABERDEEN,Shuttle Tanker,47274,17419,1996,Bahamas,,Chevron Corp,United States Of America,Teekay Norway AS,Getty Maritime Inc,Bahamas,Aliaga,Turkey,2021-05-01 00:00:00,,,
7421980,TANTAWAN FPSO,"FPSO, Oil",67408,25662,1976,Bahamas,,Chevron Corp,United States Of America,Chevron Offshore Thailand Ltd,Chevron/Palang/Orange,Thailand,Aliaga,Turkey,2021-05-01 00:00:00,,,
8753225,ROVER,"Drilling Rig, semi Submersible",18871,18889,1973,St Kitts & Nevis,Marshall Islands,Diamond Offshore Services Co,United States Of America,Unknown,Diamond Offshore Drilling Ltd,Cayman Islands,Alang,India,2021-05-01 00:00:00,,,
7821154,TEXAS ENTERPRISE,Bulk Carrier,21734,7646,1981,United States Of America,,International Shipholding Corp,United States Of America,US United Ocean Services LLC,United Ocean Services Inc,United States Of America,Alang,India,2021-05-01 00:00:00,,,
8324995,ABI,General Cargo Ship,3955,2147,1984,Comoros,,Unknown,Unknown,Cedar Marine Services SAL,Cedar Marine Services SAL,Lebanon,Gadani,Pakistan,2021-05-01 00:00:00,,,
7369118,PRAY,Passenger/Ro-Ro Ship (Vehicles),7564,3612,1974,Tanzania (Zanzibar),Unknown,Unknown,Unknown,Unknown,Unknown,Unknown,Aliaga,Turkey,2021-05-01 00:00:00,,,
9114830,SHUEN FAR 168,Products Tanker,5537,2316,1995,Belize,,Unknown,Unknown,Thrive Most Ltd,Thrive Most Ltd,British Virgin Islands,Chittagong,Bangladesh,2021-05-01 00:00:00,,,
7810571,WIN SHENG 6,Refrigerated Cargo Ship,4177,2836,1979,St Kitts & Nevis,,Unknown,Unknown,Jia Hang Shipping Ltd,Jia Hang Shipping Ltd,Hong Kong,Chittagong,Bangladesh,2021-05-01 00:00:00,,,
8914946,AEK KANOPAN 88,Chemical/Products Tanker,4740,2650,1990,Palau,,Unknown,Unknown,Fairwind Navigation Ltd,French Lilac Ltd,Seychelles,Chittagong,Bangladesh,2021-05-01 00:00:00,,,
9156852,GLOCEM,Bulk Carrier,2220,1217,1997,Panama,,Unknown,Unknown,SALS Shipping Pvt Ltd,Glomarine Ltd,United Arab Emirates,Alang,India,2021-05-01 00:00:00,,,
9161895,RA I,Chemical/Products Tanker,14842,5344,1998,Palau,Gabon,Unknown,Unknown,Lingsheng HK Marine Co Ltd,Lingsheng HK Marine Co Ltd,Hong Kong,Alang,India,2021-05-01 00:00:00,,,
7909619,LADY CAROLINE,Passenger/Ro-Ro Ship (Vehicles),1734,948,1980,Tanzania (Zanzibar),Syria,Unknown,Unknown,Unknown,Unknown,Unknown,Aliaga,Turkey,2021-05-01 00:00:00,,,
9053220,SEA JADE,Chemical/Products Tanker,11426,5999,1994,Sierra Leone,,Unknown,Unknown,Special Wealth Ltd,Full Victory Enterprise Co Ltd,Anguilla,Chittagong,Bangladesh,2021-05-01 00:00:00,,,
8322961,BAB ADEN,Chemical/Products Tanker,3742,1987,1984,Yemen,,Yemeni Republic Govt,Yemen,Aden Refinery Co,Aden Refinery Co,Yemen,Gadani,Pakistan,2021-05-01 00:00:00,,,
9030620,PALMYRA,Products Tanker,2997,1944,1991,Togo,,Artil General Trading Co WLL,Bahrain,Artil General Trading Co WLL,Artil General Trading Co WLL,Bahrain,Gadani,Pakistan,2021-06-01 00:00:00,,,
9209130,NAVION OSLO,Shuttle Tanker,55756,17953,2001,Togo,Norway,Altera Infrastructure LP,Bermuda,Altera Infrastructure Norway,Altera Shuttle Loading Pte Ltd,Singapore,Aliaga,Turkey,2021-06-01 00:00:00,,,
8756265,NOBLE PAUL ROMANO,"Drilling Rig, semi Submersible",15314,18606,1981,Cameroon,Liberia,Borr Drilling Ltd,Bermuda,Noble Drilling Services Inc,Noble Holding SCS,Luxembourg,Aliaga,Turkey,2021-06-01 00:00:00,,,
8755857,AGON,"Drilling Rig, jack up",8168,11080,1982,Togo,,Borr Drilling Ltd,Bermuda,Spirit Energy Ltd,Paragon Asset Co Ltd,Cayman Islands,Aliaga,Turkey,2021-06-01 00:00:00,,,
7336460,DIEGO RAMIREZ,Fishing Vessel,1758,,1974,Chile,,Deris SA,Chile,Deris SA,Deris SA,Chile,Gijon,Spain,2021-06-01 00:00:00,,,
9216913,ELKA ANGELIQUE,Chemical/Products Tanker,27539,10182,2001,Liberia,,European Navigation Inc,Greece,Angelique Shipping,Angelique Shipping,Liberia,Gadani,Pakistan,2021-06-01 00:00:00,,,
9196668,ELENA,General Cargo Ship,4476,2957,1999,Sierra Leone,,Forward Marine Ltd,Hong Kong,Forward Marine Ltd,Jingjiang Wantong Shpg Ind Co,China ,Chittagong,Bangladesh,2021-06-01 00:00:00,,,
7359498,STARRY METROPOLIS,Passenger/Cruise,15791,9348,1976,Liberia,Jamaica,Hopewin Ship Management,Hong Kong,Hopewin Ship Management,Income China International,British Virgin Islands,Alang,India,2021-06-01 00:00:00,,,
8003993,MARS,Fishing Vessel,716,,1981,Iceland,,Reykjavikur Ehf,Iceland,Reykjavikur Ehf,Reykjavikur Ehf,Iceland,Ghent,Belgium,2021-06-01 00:00:00,,,
9017678,PIONEER,Chemical/Products Tanker,4526,2507,1992,St Kitts & Nevis,India,Integrity Ships Pvt Ltd,India,Integrity Ships Pvt Ltd,Integrity Ships Pvt Ltd,India,Alang,India,2021-06-01 00:00:00,,,
9129940,SPLENDOUR EMERALD,Chemical/Products Tanker,28357,9696,1998,Panama,,Shan Ship Management Pvt Ltd,India,Shan Ship Management Pvt Ltd,Splendour Marine Services Ltd,Marshall Islands,Gadani,Pakistan,2021-06-01 00:00:00,,,
9191797,TAG 16,Anchor Handling Tug Supply,1734,1472,1999,St Kitts & Nevis,India,Tag Offshore Ltd,India,Tag Offshore Ltd,Tag Offshore Ltd,India,Alang,India,2021-06-01 00:00:00,,,
9169354,TAG 19,Anchor Handling Tug Supply,1974,1944,1998,St Kitts & Nevis,India,Tag Offshore Ltd,India,Tag Offshore Ltd,Tag Offshore Ltd,India,Alang,India,2021-06-01 00:00:00,,,
9126039,T 20,Platform Supply Ship,3603,2506,1996,St Kitts & Nevis,India,Tag Offshore Ltd,India,Tag Offshore Ltd,Tag Offshore Ltd,India,Alang,India,2021-06-01 00:00:00,,,
9149457,STAG,Anchor Handling Tug Supply,1974,1960,1997,St Kitts & Nevis,India,Tag Offshore Ltd,India,Tag Offshore Ltd,Tag Offshore Ltd,India,Alang,India,2021-06-01 00:00:00,,,
9180920,BULL SULAWESI,Crude/Oil Products Tanker,61764,19601,1999,Indonesia,,Buana Lintas Lautan Tbk PT,Indonesia,Gemilang Bina Lintas Tirta PT,Nusa Bhakti Jayaraya PT,Indonesia,Chittagong,Bangladesh,2021-06-01 00:00:00,,,
9154608,KT 02,Bulk Carrier,25982,7456,1998,Indonesia,,Karya Tehnik Operator,Indonesia,Karya Sumber Energy PT,Karya Tehnik Operator,Indonesia,Chittagong,Bangladesh,2021-06-01 00:00:00,,,
9173642,OCEAN LILA,Crude Oil Tanker,58374,17124,1999,Comoros,Indonesia,Soechi Group PT,Indonesia,Soechi Group PT,Lintas Samudra Maritim,Indonesia,Chittagong,Bangladesh,2021-06-01 00:00:00,,,
9179878,K LINE 1,Ro-Ro Cargo Ship,6749,4080,1997,Comoros,Korea (South),K Line Group,Japan,Jeju K Line Co Ltd,Jeju K Line Co Ltd,Korea (South),Chittagong,Bangladesh,2021-06-01 00:00:00,,,
8817100,SEA CRUISER 1,Vehicles Carrier,7694,,1989,Panama,,Toyofuji Shipping Co Ltd,Japan,Toyofuji Shipping Co Ltd,Feng Li Maritime Corp,Panama,Aliaga,Turkey,2021-06-01 00:00:00,,,
9117351,STELLA 1,Ro-Ro Cargo Ship,15195,10560,1995,Comoros,Korea (South),Hanil Express Co Ltd,Korea (South),Hanil Express Co Ltd,Hanil Express Co Ltd,Korea (South),Chittagong,Bangladesh,2021-06-01 00:00:00,,,
8119728,GORY,Trailing Suction Hopper Dredger,33155,21187,1985,St Kitts & Nevis,Belize,Hyundai Corp,Korea (South),Hyundai Engineering,Hyundai Engineering & Steel,Korea (South),Chittagong,Bangladesh,2021-06-01 00:00:00,,,
7619575,CARIBBEAN ENERGY,LNG Tanker,93619,31143,1980,Korea (South),,Sinokor Merchant Marine Co Ltd,Korea (South),Sinokor Maritime Co Ltd,Sinokor Maritime Co Ltd,Korea (South),Chittagong,Bangladesh,2021-06-01 00:00:00,,,
9151137,NORI,Chemical/Products Tanker,6268,3199,1997,St Kitts & Nevis,Panama,Sunwoo Merchant Marine Co Ltd,Korea (South),KSIM Co Ltd,Golden Slumbers Shipping SA,Panama,Alang,India,2021-06-01 00:00:00,,,
9166558,SHAY,Products Tanker,28519,9289,1998,Gabon,Panama,Arab Maritime Petroleum Trans,Kuwait,Arab Maritime Petroleum Trans,Arab Maritime Petroleum Trans,Kuwait,Gadani,Pakistan,2021-06-01 00:00:00,,,
9081837,HAZEL,Crude/Oil Products Tanker,28507,9597,1995,Comoros,,Kouros Ventures,Marshall Islands,Kouros Ventures Ltd,Kouros Ventures Ltd,Marshall Islands,Gadani,Pakistan,2021-06-01 00:00:00,,,
9550230,POSH GENTIL,Anchor Handling Tug Supply,2538,,2010,Mexico,,PACC Offshore Mexico SA de CV,Mexico,PACC Offshore Mexico SA de CV,Posh Skua SA de CV,Mexico,Unknown,Mexico,2021-06-01 00:00:00,,,
8304567,VOLVOX DELTA,Trailing Suction Hopper Dredger,8089,6316,1984,India,,Van Oord NV,Netherlands,Van Oord NV,Van Oord India Pvt Ltd,India,Aliaga,Turkey,2021-06-01 00:00:00,,,
7369027,TERNESKJAER,General Cargo Ship,882,,1974,Norway,,Austevoll Melaks AS,Norway,Maritime Management AS,Bio Feeder AS,Norway,Esbjerg,Denmark,2021-06-01 00:00:00,,,
9112155,B GAS COMMANDER,LPG Tanker,2458,1493,1996,Malta,,Bergshav AS,Norway,B-Gas A/S,LPG Invest AS,Norway,Aliaga,Turkey,2021-06-01 00:00:00,,,
9187502,WESTERN TRIDENT,Research Survey Vessel,8369,,1999,Panama,,Shearwater Geoservices Holding,Norway,Reflection Marine UK Ltd,Shearwater Geoservices Assets,Norway,Aliaga,Turkey,2021-06-01 00:00:00,,,
9054822,ABLE II,Products Tanker,1633,1016,1992,Tanzania (Zanzibar),,Hyperactive Management,Panama,Hyperactive Management Inc,Admiral Shipping Services Inc,Panama,Gadani,Pakistan,2021-06-01 00:00:00,,,
8221947,PS REEFER,Refrigerated Cargo Ship,2047,,1982,Panama,,Pacsun Shipping SA,Panama,Pacsun Shipping SA,Pacsun Shipping SA,Panama,Unknown,Unknown,2021-06-01 00:00:00,,,
8810176,AMUR,Products Tanker,5038,2857,1991,Russia,,Kasatka Co Ltd,Russia,Kasatka Co Ltd,Kasatka Co Ltd,Russia,Alang,India,2021-06-01 00:00:00,,,
8509131,ALTAIR,Fish Factory Ship,3862,3250,1987,St Kitts & Nevis,Russia,Ostrov Sakhalin JSC,Russia,Ostrov Sakhalin JSC,Ostrov Sakhalin JSC,Russia,Alang,India,2021-06-01 00:00:00,,,
9051399,JIA HANG,Products Tanker,6544,3590,1993,St Kitts & Nevis,Mongolia,EastAsia Shipping and Marine,Singapore,EastAsia Shipping & Marine Pte,Rich United Trading Ltd,Seychelles,Chittagong,Bangladesh,2021-06-01 00:00:00,,,
9102265,EM VITALITY,"FSO, Oil",163882,48087,1996,Cook Islands,,Equatorial Marine Fuel Mgmt,Singapore,Equatorial Marine Fuel Mgmt,Equatorial Marine Fuel Mgmt,Singapore,Chittagong,Bangladesh,2021-06-01 00:00:00,,,
9123386,FALCON,Chemical/Products Tanker,13292,6695,1996,Panama,,Glory Ship Management Pte Ltd,Singapore,Glory Ship Management Pte Ltd,Benoa Maritime Ltd SA,Panama,Alang,India,2021-06-01 00:00:00,,,
9002207,MED,Crude Oil Tanker,80000,20584,1991,Palau,Cook Islands,Hin Leong Trading Pte Ltd,Singapore,Ritz Ship Management Pte Ltd,Dayuan Holdings Corp,Panama,Chittagong,Bangladesh,2021-06-01 00:00:00,,,
9019327,PRESTIG,Products Tanker ,2739,1561,1991,St Kitts & Nevis,Cook Islands,Hin Leong Trading Pte Ltd,Singapore,Daichi Shipmanagement Pte Ltd,Dong Fang Shipping & Trading,Singapore,Chittagong,Bangladesh,2021-06-01 00:00:00,,,
6921828,LEISURE,Passenger/Cruise,15653,9630,1969,St Kitts & Nevis,Panama,Universal Shipmanagement,Singapore,Universal Shipmanagement,Queenston Maritime Ltd,Tuvalu,Alang,India,2021-06-01 00:00:00,,,
9149237,AZOV SEA,Chemical/Products Tanker,27526,9961,1998,Tuvalu,,Wilmar Ship Holdings Pte Ltd,Singapore,Raffles Shipmanagement Serv,Cosmos Maritime Pte Ltd,Singapore,Alang,India,2021-06-01 00:00:00,,,
9205081,VINSON,"FSO, Oil",163761,46310,2001,Comoros,Panama,Winson Oil Trading Pte Ltd,Singapore,Winson Oil Trading Pte Ltd,Laughing Hill Ltd,British Virgin Islands,Chittagong,Bangladesh,2021-06-01 00:00:00,,,
8400579,TABERNACLE PRINCE,Cement Carrier,11276,5360,1984,Sri Lanka,,Tokyo Cement Co Lanka,Sri Lanka,Ocean Ship Management Pte Ltd,Fuji Cement Co Lanka Ltd,Sri Lanka,Chittagong,Bangladesh,2021-06-01 00:00:00,,,
8322909,LEE FONT,Chemical/Products Tanker,2539,1537,1984,Sierra Leone,,De Biao Y,Taiwan,De Biao Y,De Biao Y,Taiwan,Chittagong,Bangladesh,2021-06-01 00:00:00,,,
8516201,TRI WINGS,Asphalt/Bitumen Tanker,4014,2771,1985,Palau,,Fairwind Navigation,Taiwan,Unknown,Unknown,Unknown,Chittagong,Bangladesh,2021-06-01 00:00:00,,,
9105657,GLORY STAR,Container Ship (Fully Cellular),4124,2157,1994,Palau,,Homemay Enterprise Co Ltd,Taiwan,Homemay Enterprise Co Ltd,Homemay Enterprise Co Ltd,Taiwan,Chittagong,Bangladesh,2021-06-01 00:00:00,,,
7913103,SW 2,Products Tanker ,3053,1835,1979,Mongolia,,Jin Hao Ship Management Co Ltd,Taiwan,Jin Hao Ship Management Co Ltd,Grand Ocean Shipping Line,Panama,Chittagong,Bangladesh,2021-06-01 00:00:00,,,
8706648,LUCK GROW 899,Products Tanker,3456,2168,1987,Mongolia,,You Young Ship Mgmt & Consult,Taiwan,You Young Ship Mgmt & Consult,Fortune Mountain Properties,British Virgin Islands,Chittagong,Bangladesh,2021-06-01 00:00:00,,,
8617512,SINDHNARA,Products Tanker,957,680,1987,Thailand,,Trans Ocean Supply 1992 Co Ltd,Thailand,Trans Ocean Supply 1992 Co Ltd,Trans Ocean Supply 1992 Co Ltd,Thailand,Chittagong,Bangladesh,2021-06-01 00:00:00,,,
9003079,KATARA,LPG Tanker,3983,2538,1993,St Vincent & The Grenadines,,Eli Investment Ltd,Turkey,Eli Investment Ltd,Eli Investment Ltd,Seychelles,Alang,India,2021-06-01 00:00:00,,,
8721404,HARATS,General Cargo Ship,2998,1865,1986,Panama,,Global Marine Consulting Ltd,Turkey,Global Marine Consulting Ltd,Albany Shipping Ltd,Seychelles,Aliaga,Turkey,2021-06-01 00:00:00,,,
8306711,RAMA-1,Products Tanker,4997,2661,1985,Panama,,Al Rafedain Marine Services,United Arab Emirates,Al Rafedain Marine Services,Infinity Trading Intl Inc,Panama,Gadani,Pakistan,2021-06-01 00:00:00,,,
7390430,INTERCOM 1,Offshore Tug/Supply Ship,864,,1974,Mongolia,Panama,Emerald Shipping Management,United Arab Emirates,Emerald Shipping Management,Emerald Shipping Management,United Arab Emirates,Gadani,Pakistan,2021-06-01 00:00:00,,,
9081813,MIRAGE,Crude/Oil Products Tanker,28507,9597,1995,Gabon,,Emirates Shipping Co LLC,United Arab Emirates,Emirates Shipping Co LLC,ES Golden Gulf Inc,Panama,Gadani,Pakistan,2021-06-01 00:00:00,,,
9156486,FRACHTIS,Products Tanker,10298,5049,1997,Comoros,Nigeria,Etihad Engineering & Marine,United Arab Emirates,Etihad Engineering & Marine,Etihad Engineering & Marine,United Arab Emirates,Gadani,Pakistan,2021-06-01 00:00:00,,,
