6815512,CAPE GIRARDEAU,General Cargo Ship,16563,,1968,United States Of America,,United States Govt,United States Of America,United States Govt MARAD,United States Govt MARAD,United States Of America,Brownsville,United States of America,2023-09-01 00:00:00,,
8835592,TRIUMPH,Research Survey Vessel,1493,,1985,United States Of America,,United States Govt,United States Of America,United States Govt MARAD,United States Govt MARAD,United States Of America,Brownsville,United States of America,2023-10-01 00:00:00,,
7320411,CAPE FLATTERY,Barge Carrier,29508,,1973,United States Of America,,United States Govt,United States Of America,United States Govt MARAD,United States Govt MARAD,United States Of America,Brownsville,United States of America,2023-10-01 00:00:00,,
6913429,CAPE NOME,General Cargo Ship (with Ro-Ro facility),20377,,1969,United States Of America,,United States Govt,United States Of America,United States Govt MARAD,United States Govt MARAD,United States Of America,Brownsville,United States of America,2023-12-01 00:00:00,,
7311989,ZAFIRO PRODUCER,"FPSO, Oil",133118,49000,1973,Liberia,,ExxonMobil Corp,United States Of America,ExxonMobil Corp,Mobil Equitorial Guinea Inc,Guinea,Frederikshavn,Denmark,2023-06-01 00:00:00,,
9176113,LILA KYOTO,Bulk Carrier,87473,21221,1999,Liberia,,Global Marketing Systems Inc,United States Of America,Arka Global Marine Services,Virgo Shipping & Trading Ltd,Liberia,Gadani,Pakistan,2023-01-01 00:00:00,,
8720840,NORTHERN PRODUCER,"Production Platform, semi submersible",12577,,1976,Cyprus,,Northern Offshore Ltd,United States Of America,Sea Production Ltd-BVI,Sea Production Ltd-BVI,"Virgin Islands, British",Kishorn,United Kingdom,2023-10-01 00:00:00,,
8119170,PUTFORD PROVIDER,Platform Supply Ship,1822,,1983,United Kingdom,,SEACOR Holdings Inc,United States Of America,Boston Putford Offshore Safety,Stirling Offshore Ltd,United Kingdom,Leith,United Kingdom,2023-03-01 00:00:00,,
7502409,JIMMY SMITH,Articulated Pusher Tug,798,,1976,United States Of America,,Discount Marine Supplies LLC,United States Of America,Discount Marine Supplies LLC,Discount Marine Supplies LLC,United States Of America,Port Mellon,Canada,2023-06-01 00:00:00,,
9126467,LEVANT HORIZON,General Cargo Ship,5712,3391,1997,Panama,,Unknown,Unknown,Ocean Summit Shipping SA,Middle East & North Africa,Panama,Alang,India,2023-03-01 00:00:00,,
9175731,CYNTH,Chemical/Products Tanker,5999,3349,1997,St Kitts & Nevis,Sierra Leone,Unknown,Unknown,Mayfield Holdings Co Ltd,Mayfield Holdings Co Ltd,Seychelles,Alang,India,2023-05-01 00:00:00,,
8213378,ALDO,Anchor Handling Tug Supply,1614,1740,1983,St Kitts & Nevis,Panama,Unknown,Unknown,Baili Shipping & Trading Ltd,Kish Offshore Inc,Panama,Alang,India,2023-09-01 00:00:00,,
9102502,MARSA IRIS,Container Ship (Fully Cellular),16800,7852,1996,St Kitts & Nevis,,Unknown,Unknown,Petra Shipping Services LLC,Marsa Glory Inc,Marshall Islands,Alang,India,2023-10-01 00:00:00,,
9215543,TYCOON,Bulk Carrier,40562,12651,2000,Liberia,,Unknown,Unknown,Delek Transport Agency Inc,Tycoon Maritime SA,Liberia,Alang,India,2023-10-01 00:00:00,,
9072185,GREAT,Bulk Carrier,36074,9759,1994,Gabon,Panama,Unknown,Unknown,Xiamen Xinjunhai Marine Mgmt,Great Wenjie Shipping Co Ltd,Hong Kong,Alang,India,2023-11-01 00:00:00,,
8805054,ANGEL-A,General Cargo Ship,2977,1391,1988,Togo,,Unknown,Unknown,Northwest Ship Management Ltd,Northwest Ship Management Ltd,Canada,Alang,India,2023-11-01 00:00:00,,
7729019,SAGNA,Products Tanker,3370,2065,1978,Palau,,Unknown,Unknown,Standard Maritime Shpg Service,Sagna Shipping Inc,Liberia,Alang,India,2023-11-01 00:00:00,,
9074808,DIAMOND WAY,Bulk Carrier,25676,9016,1995,Palau,,Unknown,Unknown,African Express Ltd,Diamond Way Maritime Ltd,Liberia,Alang,India,2023-11-01 00:00:00,,
9115004,YANG,Bulk Carrier,25997,7481,1995,St Kitts & Nevis,Belize,Unknown,Unknown,Xiamen Xinjunhai Marine Mgmt,Wuyang Goddess Shipping Co Ltd,Hong Kong,Alang,India,2023-12-01 00:00:00,,
8914726,DAYTONA DYNAMIC,Bulk Carrier,17066,6058,1990,Comoros,,Unknown,Unknown,Cedar Marine Services SAL,Daytona Dynamic Ltd,Liberia,Alang,India,2023-12-01 00:00:00,,
9117131,SILK,Container Ship (Fully Cellular),15533,7036,1996,Comoros,Liberia,Unknown,Unknown,SM Line Corp,Ocean Silkway Shipping Ltd,Hong Kong,Alang,India,2023-12-01 00:00:00,,
8716019,BARIS,General Cargo Ship,1355,935,1987,Togo,Unknown,Unknown,Unknown,Unknown,Unknown,Unknown,Aliaga,Turkey,2023-05-01 00:00:00,,
7602699,MSB-1,General Cargo Ship,2577,,1977,Tanzania   ,Togo,Unknown,Unknown,Manassa 2M Shipmanagement Co,CR 7 Shipping SA,Honduras,Aliaga,Turkey,2023-10-01 00:00:00,,
7526699,LEADER M,General Cargo Ship,3136,1593,1977,Tanzania   ,,Unknown,Unknown,Unknown,Unknown,Unknown,Aliaga,Turkey,2023-12-01 00:00:00,,
8522092,FLIPPER 4,Fishing Vessel,1898,1780,1985,Guinea-Bissau,,Unknown,Unknown,Unknown,Unknown,Unknown,Aliaga,Turkey,2023-12-01 00:00:00,,
8313192,HONG FA,Chemical/Products Tanker,3855,2172,1983,St Kitts & Nevis,Unknown,Unknown,Unknown,Unknown,Unknown,Unknown,Chittagong,Bangladesh,2023-01-01 00:00:00,,
9149017,LILY BREEZE,Bulk Carrier,38846,9898,1998,Panama,,Unknown,Unknown,Aggregate for Ships Co,New Prosperity Shipping SA,Panama,Chittagong,Bangladesh,2023-04-01 00:00:00,,
8900983,ATLANTIC RAY,General Cargo Ship,3988,2461,1991,Tanzania   ,Unknown,Unknown,Unknown,Unknown,Unknown,Unknown,Chittagong,Bangladesh,2023-05-01 00:00:00,,
9137430,JASMINE II,Bulk Carrier,27552,9563,1997,St Kitts & Nevis,,Unknown,Unknown,Al Shumookh Construction,Riverbed Shipping & Trading Co,Panama,Chittagong,Bangladesh,2023-06-01 00:00:00,,
8609125,DPL ALYUR,General Cargo Ship,1882,1020,1986,Mongolia,Togo,Unknown,Unknown,Dalitora Projects LP,Transmar Business Corp,Panama,Chittagong,Bangladesh,2023-06-01 00:00:00,,
9117624,LAUREN OCEAN,Bulk Carrier,24608,8400,1996,Panama,,Unknown,Unknown,Asia-Euro Ship Management Ltd,Franbo Sino Ltd,Marshall Islands,Chittagong,Bangladesh,2023-08-01 00:00:00,,
9184914,OCEAN SUCCESS,Bulk Carrier,37695,10163,1998,Panama,,Unknown,Unknown,Grand Voyage Marine Co Ltd,Brave Joy Ltd,Hong Kong,Chittagong,Bangladesh,2023-08-01 00:00:00,,
9036806,SHUN,Bulk Carrier,38481,10356,1994,St Kitts & Nevis,Panama,Unknown,Unknown,Xingle Shipping HK,Xingle Shipping HK,Hong Kong,Chittagong,Bangladesh,2023-09-01 00:00:00,,
9106704,HAVEN GUARDER,Bulk Carrier,17075,6079,1995,Panama,,Unknown,Unknown,Elite Guard Shipping Ltd-HKG,Elite Guard Shipping Inc-SEY,Seychelles,Chittagong,Bangladesh,2023-09-01 00:00:00,,
9055450,YANGO,Container Ship (Fully Cellular),15183,5866,1993,Comoros,Panama,Unknown,Unknown,COSCO Shipping Lines Co Ltd,Maxwin Assets Holding Ltd,"Virgin Islands, British",Chittagong,Bangladesh,2023-11-01 00:00:00,,
9117181,LUCKY D,Container Ship (Fully Cellular),17287,8170,1996,Comoros,Liberia,Unknown,Unknown,CMA CGM SA The French Line,Luck Shipping Ltd,Marshall Islands,Chittagong,Bangladesh,2023-11-01 00:00:00,,
8794176,SHUN SHIN,General Cargo Ship,1396,527,2005,Unknown,Mongolia,Unknown,Unknown,You Young Ship Mgmt & Consult,Wise Star Global Ltd,Seychelles,Chittagong,Bangladesh,2023-12-01 00:00:00,,
8906846,MURAT BEY,Bulk Carrier,23274,6729,1990,Tanzania   ,,Unknown,Unknown,Fams Venture Holdings Inc,Fams Venture Holdings Inc,Marshall Islands,Gadani,Pakistan,2023-01-01 00:00:00,,
8028412,ANNIE HILLINA,Fishing Vessel,2417,1625,1981,Germany,,Unknown,Unknown,Parlevliet & van der Plas,Ostbank Hochseefischerei,Germany,Ghent,Belgium,2023-07-01 00:00:00,,
7363217,POSEIDON,Research Survey Vessel,1412,,1975,Unknown,Iceland,Unknown,Unknown,Unknown,Unknown,Unknown,Gijon,Spain,2023-10-01 00:00:00,,
8635033,BRAMBLE,"Museum, Stationary",790,,1944,United States Of America,,Unknown,Unknown,Unknown,Unknown,Unknown,Mobile,United States of America,2023-12-01 00:00:00,,
8011720,FRIOSUR VIII,Fishing Vessel,930,,1982,Cameroon,Chile,Fewell SA,Uruguay,Fewell SA,Fewell SA,Uruguay,Aliaga,Turkey,2023-08-01 00:00:00,,
9145425,SPM AGILITY,Chemical/Products Tanker,21609,10932,1998,Panama,Vietnam,PETROVIETNAM,Vietnam,Petrovietnam Transportation,PVTrans Petro,Vietnam,Alang,India,2023-01-01 00:00:00,,
8814225,APOLLO PACIFIC,LPG Tanker,3354,2189,1988,Vietnam,,Vietnam Govt,Vietnam,Nhat Viet Transportation Corp,Nhat Viet Transportation Corp,Vietnam,Alang,India,2023-04-01 00:00:00,,
9008677,O STAR,Bulk Carrier,17130,6407,1990,St Kitts & Nevis,Vietnam,Intl Transport & Trading JSC,Vietnam,Intl Transport & Trading JSC,Intl Transport & Trading JSC,Vietnam,Chittagong,Bangladesh,2023-01-01 00:00:00,,
9135511,GOLDEN SUN,Bulk Carrier,17075,6179,1996,Panama,,Asia Pacific Shipping Co Ltd,Vietnam,Asia Pacific Shipping Co Ltd,Asia Pacific Shipping Co Ltd,Vietnam,Chittagong,Bangladesh,2023-06-01 00:00:00,,
